04341710000136;CONDOMINIO ILHAS GREGAS;R NUNES VALENTE 275;MEIRELES;60125070;FORTALEZA;CE;
04342328000147;CONDOMINIO DO ED RESIDENCE MONTSOURIS;R EDUARDO GARCIA 888;ALDEOTA;60150100;FORTALEZA;CE;
04350875000174;CONDOMINIO ED BENTO ALBUQUERQUE;R BENTO ALBUQUERQUE 1599;COCO;60192055;FORTALEZA;CE;
04366471000179;CONDOMINIO ED RESIDENSIALI DI FORLI;R VICENTE LOPES 685;CIDADE DOS FUNCIONARIOS;60822104;FORTALEZA;CE;
04373078000102;CONDOMINIO ED RUY CASTELO BRANCO;R JUAZEIRO DO NORTE 333;MEIRELES;60165110;FORTALEZA;CE;
04375450000110;CONDOMINIO HORIZONTAL INTERLAGOS;R JORGE SEVERIANO 2120;VL UNIAO;60420180;FORTALEZA;CE;
04375600000195;CONDOMINIO RESIDENCIAL ANA ROSE;R PIAUI SN;VL MANOEL SATIRO;60730001;FORTALEZA;CE;
04396376000118;CONDOMINIO JAMILLE PINHEIRO;R JOAQUIM PIMENTA 207;MONTESE;60410220;FORTALEZA;CE;
04399542000130;CONDOMINIO AMERICA DO SUL;R INACIO VASCONCELOS 227;MESSEJANA;60841535;FORTALEZA;CE;
04401367000178;CONDOMINIO ED THIERRY TOWER;R CARLOS VASCONCELOS 1411;ALDEOTA;60115171;FORTALEZA;CE;
04401513000165;CONDOMINIO EAST POINT;R GASTAO JUSTA 700;MONDUBIM;60762060;FORTALEZA;CE;
04405237000103;CONDOMINIO RESIDENCIAL EVEREST;AV JOAO PESSOA 6943;PARANGABA;60721340;FORTALEZA;CE;
04410107000169;CONDOMINIO ED MELO;R CNSO TRISTAO 277;JOSE BONIFACIO;60050101;FORTALEZA;CE;
04412141000172;CONDOMINIO ED MISSISSIPI;R OSVALDO CRUZ 2920 COND;DIONISIO TORRES;60125151;FORTALEZA;CE;
04414133000165;CONDOMINIO SANDALO;R CEL JOAO AUGUSTO LIMA 90;PATRIOLINO RIBEIRO;60810321;FORTALEZA;CE;
04414169000149;CONDOMINIO CRYSTAL PALACE;R CEL JOAO AUGUSTO LIMA 30;PATRIOLINO RIBEIRO;60810321;FORTALEZA;CE;
04416546000189;CONDOMINIO RESIDENCIAL VILA RICA;AV ENG AGRONOMO JOSE GUIMARAES DUQUE 1090 LAGO JACAREY;CAMBEBA;60822220;FORTALEZA;CE;
04419609000150;CONDOMINIO STRAUSS;R MNS BRUNO 866 C;ALDEOTA;60115191;FORTALEZA;CE;
04422619000145;CONDOMINIO GREEN VALEY VILLAGE;R JULIO LIMA 300;CIDADE DOS FUNCIONARIOS;60822500;FORTALEZA;CE;
04424998000102;CONDOMINIO RESIDENCIAL SEVILHA;AV DOS EXPEDICIONARIOS 5571;VL UNIAO;60410545;FORTALEZA;CE;
04428463000100;EDIFICIO VICTORIA PARK;R ARQO REGINALDO RANGEL 155;COCO;60192320;FORTALEZA;CE;
04433239000106;CONDOMINIO EMILIO CHASTINET;R JOAQUIM LIMA 679;PAPICU;60175005;FORTALEZA;CE;
04440282000107;CONDOMINIO ED MINTARRA;R NOGUEIRA ACIOLI 1002;CENTRO;60110140;FORTALEZA;CE;
04442213000124;EDIFICIO RESIDENCIAL SANTABAYA;R SANTABAIA 81;PARANGABA;60720630;FORTALEZA;CE;
04444780000110;CONDOMINIO ED SAN TORINO;R J DA PENHA 248;CENTRO;60110120;FORTALEZA;CE;
04445461000129;CONDOMINIO TUIUTI;R PASCOAL DE CASTRO ALVES 51 AP 602;VICENTE PINZON;60181225;FORTALEZA;CE;
04448464000116;CONDOMINIO RESIDENCIAL AROEIRAS;R DAS AROEIRAS 200;PASSARE;60743820;FORTALEZA;CE;
04450283000124;CONDOMINIO ED TIAGO III;R ANASTACIO MENDES BRAGA 165;ENG LUCIANO CAVALCANTE;60813700;FORTALEZA;CE;
04454210000100;CONDOMINIO ARVOREDO;R CAP AMERICO MENEZES 405;PARANGABA;60710130;FORTALEZA;CE;
04460255000198;CONDOMINIO ED ALEXANDRE MAGNO;R MAJ LAURINDO 200;BENFICA;60020070;FORTALEZA;CE;
04463199000145;CONDOMINIO RESIDENCIAL ALGARVE;R ASSUNCAO 1461;JD CEARENSE;60712020;FORTALEZA;CE;
04465765000158;EDIFICIO SANTA CECILIA;R BENTO ALBUQUERQUE 685;COCO;60192060;FORTALEZA;CE;
04477067000172;CONDOMINIO DO ED VALE DOS REIS;R JOSE VILAR 2281;DIONISIO TORRES;60125001;FORTALEZA;CE;
04485023000194;CONDOMINIO DO ED ANANIAS FERREIRA DE SOUSA;R JOSE ACIOLY 344;ANTONIO BEZERRA;60350300;FORTALEZA;CE;
04487645000151;CONDOMINIO SHOPPING LISBONENSE;R PEDRO BORGES 143;CENTRO;60055110;FORTALEZA;CE;
04488791000100;CONDOMINIO DO ED COML CASA ROSADA MALL;R PAULA RODRIGUES 260 LJ 13;FATIMA;60411270;FORTALEZA;CE;
04490985000131;CONDOMINIO BOULEVARD DOM LUIZ;R TIBURCIO CAVALCANTE 810;MEIRELES;60125100;FORTALEZA;CE;
04491686000111;EDIFICIO DR GUARANY;AV SEN VIRGILIO TAVORA 280;MEIRELES;60170250;FORTALEZA;CE;
04493236000168;CONDOMINIO ED TULIPA;R PROF CARVALHO 3063 CONDOMINO;JOAQUIM TAVORA;60120205;FORTALEZA;CE;
04493948000187;CONDOMINIO RESIDENCIAL PRUDENTE BRASIL;AV HEROIS DO ACRE 725;PASSARE;60743760;FORTALEZA;CE;
04497345000153;CONDOMINIO DO ED ASSIS CHATEAUBRIAND;R ASSIS CHATEAUBRIAND 260;DIONISIO TORRES;60135200;FORTALEZA;CE;
04506611000167;CONDOMINIO ED DRAGAO DO MAR RESIDENCE SERVICE;R TOMAS LOPES 200;PR DE IRACEMA;60060260;FORTALEZA;CE;
04506696000183;EDIFICIO ASTORGA;AV CESAR CALS 2666;ANTONIO DIOGO;60182405;FORTALEZA;CE;
04509282000108;RESIDENCIAL SAN MARINO;R VICENTE LOPES 545;CIDADE DOS FUNCIONARIOS;60822104;FORTALEZA;CE;
04510190000148;CONDOMINIO MORADA DO FUTURO I E II;AV CESAR CALS 490 500;VICENTE PINZON;60182005;FORTALEZA;CE;
04529123000175;CONDOMINIO DE CONSTRUCAO ED HIRAN MONTEIRO;R GUILHERME MOREIRA 371;FATIMA;60040490;FORTALEZA;CE;
04558541000190;CONDOMINIO MANDACARUS;R DAS OITICICAS 659;PASSARE;60743790;FORTALEZA;CE;
04560255000160;CONDOMINIO EDIFICIO ALEXANDRE MAGNO;RUA MAJOR LAURINDO 200 ;BENFICA;60020070;FORTALEZA;CE;
04566118000132;CONDOMINIO AGUA FRIA;R ADAIL TEIXEIRA 110;EDSON QUEIROZ;60811730;FORTALEZA;CE;
04566161000106;CONDOMINIO ED GEORGIA PLACE;R CEL JUCA 1724;DIONISIO TORRES;60170195;FORTALEZA;CE;
04583231000126;CONDOMINIO RESIDENCIAL VILA REAL;R CIBELE 65;MESSEJANA;60842400;FORTALEZA;CE;
04583314000115;CONDOMINIO MARIA MARTINS;R LEON GRADVOHL 216;PARANGABA;60711150;FORTALEZA;CE;
04585868000151;CONDOMINIO ED SILVIA;R SILVA JATAHY 1055;MEIRELES;60165070;FORTALEZA;CE;
04593147000193;CONDOMINIO ED YACHT COAST RESIDENCE;AV DA ABOLICAO 4521;MUCURIPE;60165085;FORTALEZA;CE;
04605379000114;EDIFICIO VILLA DE TRENTO;AV ENG ALBERTO SA 1240;PAPICU;60175395;FORTALEZA;CE;
04620591000150;CONDOMINIO RESIDENCIAL VIVENDAS SABIAS;R DOS SABIAS 653;PASSARE;60743830;FORTALEZA;CE;
04620891000130;RESIDENCIAL BOSQUE ALEGRE;R HOMEM DE MELO 1291;CAMBEBA;60822345;FORTALEZA;CE;
04625678000110;CONDOMINIO ED COSTA MARINA;AV DA ABOLICAO 4573;MUCURIPE;60165085;FORTALEZA;CE;
04635511000130;RESIDENCIAL PARQUE DAS DAMAS I;R G 270;MANOEL DIAS BRANCO;60191070;FORTALEZA;CE;
04638543000190;CONDOMINIO RESIDENCIAL MANAIRA;VL GESSI 885;CIDADE DOS FUNCIONARIOS;60823010;FORTALEZA;CE;
04644036000169;CONDOMINIO ED RESIDENCIAL IMIRA;R JOAQUIM NABUCO 3245;S JOAO DO TAUAPE;60120315;FORTALEZA;CE;
04646134000135;EDIFICIO GIARDINO DI PARMA;R CARLOTA PINHEIRO 350;PATRIOLINO RIBEIRO;60810019;FORTALEZA;CE;
04675797000188;MARESIA;R MIN ABNER DE VASCONCELOS 301 COND MARESIA;AGUA FRIA;60833490;FORTALEZA;CE;
04678969000177;CONDOMINIO ED LIVIA;VL DR ROCHA LIMA 1568 TER;S GERARDO;60325080;FORTALEZA;CE;
04686461000110;CONDOMINIO ED TURMALINA;AV CEL MIGUEL DIAS 1477;PATRIOLINO RIBEIRO;60810160;FORTALEZA;CE;
04694182000107;CONDOMINIO ERICA E ADRIANNE;R JOAO SORONGO 55;JD AMERICA;60416000;FORTALEZA;CE;
04699572000161;CONDOMNIO EDIFCIO NANCY BORGES;R PROF FRANCISCO GONCALVES 640;DIONISIO TORRES;60135430;FORTALEZA;CE;
04701755000174;CONDOMINIO RESIDENCIAL ITAPERY VII;R DAS CARNAUBAS 750;PASSARE;60743780;FORTALEZA;CE;
04704207000106;EDIFICIO ANA NEYLE VIDAL;R MNS BRUNO 520;MEIRELES;60115190;FORTALEZA;CE;
04704539000182;RESIDENCIAL NOSSA SENHORA DE FATIMA I;R ANTONIO LUIS ALMEIDA VALE 100;MONDUBIM;60762375;FORTALEZA;CE;
04706351000173;CONDOMINIO ED GUSTAVO BELCHIOR FERNANDES;R VILEBALDO AGUIAR 3260;MANOEL DIAS BRANCO;60191375;FORTALEZA;CE;
04706367000186;CONDOMINIO ED TURANDOT;R ALFEU ABOIM 535;PAPICU;60175375;FORTALEZA;CE;
04711101000121;CONDOMINIO ED SANTORINI;R JOSE VILAR 196;MEIRELES;60125000;FORTALEZA;CE;
04711591000166;EDIFICIO TATIANA FEITOSA;R VICENTE LINHARES 770;ALDEOTA;60135270;FORTALEZA;CE;
04723932000113;RESIDENCIAL ACACIAS I;R ANTONIO BARROS 1911;MESSEJANA;60840370;FORTALEZA;CE;
04723950000103;RESIDENCIAL ACACIAS II;R ANTONIO BARROS 1914;MESSEJANA;60840370;FORTALEZA;CE;
04723976000143;RESIDENCIAL MORADA DOS LIRIOS;R CAP JUSTINO FERREIRA RAMOS 350;CURIO;60844025;FORTALEZA;CE;
04724028000122;RESIDENCIAL SOLAR DOS COQUEIROS;R GERALDO SOARES 536;BARROSO;60863220;FORTALEZA;CE;
04729985000141;CONDOMINIO DO HORIZONTAL RESIDENCIAL ITAPERY VI;AV DOS PAROARAS 160;PASSARE;60744040;FORTALEZA;CE;
04730056000152;CONDOMINIO ED PORTAL DE SERRAMBI;R CARLOS BARBOSA 450;PAPICU;60175355;FORTALEZA;CE;
04731539000171;CONDOMINIO RESIDENCIAL FLEURS DES CHAMPS;R ARAUJO COSTA 149;MONDUBIM;60711740;FORTALEZA;CE;
04737534000156;CONDOMINIO ED DELOS;R JOSE VILAR 300;MEIRELES;60125000;FORTALEZA;CE;
04738162000182;EDIFICIO MASCARENHAS;R BR DE ARACATI 2715;JOAQUIM TAVORA;60115082;FORTALEZA;CE;
04739879000149;CONDOMINIO RESIDENCIAL CONCORDE;R CON LIMA SUCUPIRA 1157;SERRINHA;60741255;FORTALEZA;CE;
04747787000100;CONDOMINIO DE CONSTRUCAO ED TRINIDAD Y TOBAGO;R CARLOS VASCONCELOS 146;MEIRELES;60115170;FORTALEZA;CE;
04761070000113;CONDOMINIO ED DUNAS;R PROF WILSON AGUIAR 250;EDSON QUEIROZ;60811590;FORTALEZA;CE;
04769732000100;EDIFICIO IMBAUBAS PARK RESIDENCE;R ONOFRE SAMPAIO CAVALCANTE 400;PRQ MANIBURA;60821820;FORTALEZA;CE;
04777659000100;CONDOMINIO SPAZZIO 1;R DR JOAQUIM FROTA 1050;JOSE DE ALENCAR;60830132;FORTALEZA;CE;
04778018000170;CONDOMINIO ED FIORE DEI CAMPI;R JULIO DA SILVEIRA 20;PARREAO;60410320;FORTALEZA;CE;
04784720000146;CONDOMINIO ED MARIANA II;R ALFEU ABOIM 401;PAPICU;60175375;FORTALEZA;CE;
04785004000183;CONDOMINIO ED ARKANSAS;R GONCALVES LEDO 1080;CENTRO;60110261;FORTALEZA;CE;
04797799000140;CONDOMINIO TOSCANA;TV NENEN ARRUDA 120;CAMBEBA;60822413;FORTALEZA;CE;
04798974000113;EDIFICIO LAURO ARAUJO;R DES MANUEL SALES ANDRADE 61;PATRIOLINO RIBEIRO;60810195;FORTALEZA;CE;
04800073000119;CONDOMINIO ED SEQUOIA;R DR BATISTA DE OLIVEIRA 800;COCO;60192340;FORTALEZA;CE;
04801705000169;CONDOMINIO DO ED CAYO LAGO RESIDENCE;R GRACILIANO RAMOS 330;FATIMA;60415050;FORTALEZA;CE;
04811404000116;EDIFICIO CABO VERDE;R ISAC AMARAL 112;DIONISIO TORRES;60135232;FORTALEZA;CE;
04821000000103;CONDOMINIO SOCORRO VILLAGE;R PROF SOLON FARIAS 37;CAMBEBA;60822210;FORTALEZA;CE;
04841559000103;EDIFICIO D EDUARDO I;R EDUARDO NOVAES 140;SAPIRANGA;60833232;FORTALEZA;CE;
04842501000176;EDIFICIO PLACE DES CYSNE;R OSVALDO CRUZ 1000;ALDEOTA;60125048;FORTALEZA;CE;
04845338000103;CONDOMINIO ED TERESIOS;R DR GILBERTO STUDART 1147;COCO;60192095;FORTALEZA;CE;
04846260000133;CONDOMINIO REAL VILLAGE RESIDENCE;R JONH LENNON 13;MESSEJANA;60841670;FORTALEZA;CE;
04852902000107;RESIDENCIAL TERRA DO MAR;R G 4 LT PARQ BOATAN 960;MANOEL DIAS BRANCO;60191070;FORTALEZA;CE;
04852917000175;RESIDENCIAL TERRA DO SOL;R G 4 LT PARQ BOATAN 973;MANOEL DIAS BRANCO;60191070;FORTALEZA;CE;
04852955000128;RESIDENCIAL SATURNO;AV ENG LEAL LIMA VERDE 1411;JOSE DE ALENCAR;60830055;FORTALEZA;CE;
04854502000130;CONDOMINIO CORDOBA RESIDENCE;R SEM DENOMINACAO OFICIAL 40 LT CIDADE SUL;JOQUEI CLUBE;60510107;FORTALEZA;CE;
04863509000119;EDIFICIO D EDMILSON CRUZ;R JOAQUIM NABUCO 2500;DIONISIO TORRES;60125121;FORTALEZA;CE;
04863572000155;EDIFICIO PARIS;R JULIO SIQUEIRA 465;DIONISIO TORRES;60135226;FORTALEZA;CE;
04864342000100;CONDOMINIO ED SANTA CRUZ;R ISRAEL BEZERRA 326;DIONISIO TORRES;60135460;FORTALEZA;CE;
04864466000196;EDIFICIO RESIDENCIAL BARRA NOVA;R IRAPUA 250;BARRA DO CEARA;60331300;FORTALEZA;CE;
04880545000190;RESIDENCIAL ARMANI;R PEDRO MUNIZ 401;DEMOCRITO ROCHA;60440060;FORTALEZA;CE;
04887401000166;CONDOMINIO LUXOR RESIDENCE;AV ENG LEAL LIMA VERDE 1471;JOSE DE ALENCAR;60830055;FORTALEZA;CE;
04893817000197;CONDOMINIO BERGAMO;R BARBARA DE ALENCAR 1460;ALDEOTA;60140025;FORTALEZA;CE;
04904094000184;CONDOMINIO MAISON VERTE;R LIDIA BRIGIDO 655;PRQ MANIBURA;60821800;FORTALEZA;CE;
04908897000107;EDIFICIO PALAZZO RIGOLETTO;R BENTO ALBUQUERQUE 969;COCO;60192055;FORTALEZA;CE;
04911062000106;CONDOMINIO DO ED COMFORT SUITES;R FR MANSUETO 160;MEIRELES;60175070;FORTALEZA;CE;
04915602000120;CONDOMINIO RESIDENCIAL GARDEM II;R NADIR SABOYA 110;EDSON QUEIROZ;60834510;FORTALEZA;CE;
04954679000109;PALAZZO PARADISO;R ELISEU ORIA 1830;AGUA FRIA;60830740;FORTALEZA;CE;
04959167000135;CONDOMINIO BELLAGIO RESIDENZA;R CARLOS VASCONCELOS 3100;JOAQUIM TAVORA;60115044;FORTALEZA;CE;
04959436000163;RESIDENCIAL PARK MARAPONGA;R JOAQUIM JERONIMO 559;MONDUBIM;60711520;FORTALEZA;CE;
04964477000148;CONDOMINIO DE CONSTRUCAO ED BEIRA MAR 2020;AV BEIRA MAR 2020;MEIRELES;60165120;FORTALEZA;CE;
04971323000183;CONDOMINIO SAN FRANCESCO;R NUNES VALENTE 1001;ALDEOTA;60125035;FORTALEZA;CE;
04979374000151;CONDOMINIO RESIDENCIAL FIRENZIE;R FULGENCIO CRUZ 216;JOSE DE ALENCAR;60830265;FORTALEZA;CE;
04986241000102;CONDOMINIO RESIDENCIAL HORTENCIAS;R OSVALDO AGUIAR 1425;JOSE DE ALENCAR;60830315;FORTALEZA;CE;
04997065000104;CONDOMINIO DO ED VILLAGE JACAREY;R CHICO LEMOS 1190;CIDADE DOS FUNCIONARIOS;60822785;FORTALEZA;CE;
05003156000140;CONDOMINIO ED ITAPARICA;R PEREIRA VALENTE 640;MEIRELES;60160250;FORTALEZA;CE;
05022581000186;CONDOMINIO ED ISABEL MARINHO;R MNS BRUNO 1350;ALDEOTA;60115191;FORTALEZA;CE;
05023992000196;CONDOMINIO ED RESIDENCIAL GOMES DE FREITAS;AV BEZERRA DE MENEZES 2270;S GERARDO;60325002;FORTALEZA;CE;
05027570000199;CONDOMINIO ESPIRITUAL UIRAPURU CEU;AV ALBERTO CRAVEIRO 2222 ;BOA VISTA;60861212;FORTALEZA;CE;
05030056000102;CONDOMINIO RESIDENCIAL DR NELSON ROCHA;R FRANKLIN TAVORA 340;CENTRO;60150110;FORTALEZA;CE;
05034606000161;ATLANTA;AV ODILON GUIMARAES 3740;LGA REDONDA;60831295;FORTALEZA;CE;residencial.atlanta@bol.com.br
05038990000170;RESIDENCIAL GREEN PARK EXPANSAO II;R PE PAULINO 401;CAJAZEIRAS;60864240;FORTALEZA;CE;
05040322000188;CONDOMINIO DO ED LUCA MARENZIO;R ALBERTO FEITOSA LIMA SN;PATRIOLINO RIBEIRO;60810018;FORTALEZA;CE;
05044203000101;EDIFICIO JUVENAL DE CARVALHO;R JUVENAL DE CARVALHO 1000;FATIMA;60050220;FORTALEZA;CE;
05049789000199;CONDOMINIO ED PORTO DE IRACEMA RESIDENCE;AV HISTO RAIMUNDO GIRAO 630;MEIRELES;60165050;FORTALEZA;CE;
05054992000153;CONDOMINIO RESIDENCIAL VI;TR DINIZ 240 ;PARQUE ITAMARATY;60875050;FORTALEZA;CE;
05055269000199;RESIDENCIAL DOUGLAS ALBUQUERQUE II;R CAMPOS NOVOS 88;BOM FUTURO;60425390;FORTALEZA;CE;
05055485000134;CONDOMINIO ED URUBURETAMA;R DR GILBERTO STUDART 1520;COCO;60192095;FORTALEZA;CE;
05057510000119;CONDOMINIO ED VOLARE I;R FRANCISCO FARIAS FILHO 130;PATRIOLINO RIBEIRO;60810110;FORTALEZA;CE;
05058303000189;CONDOMINIO DRA MARTA;R DAS CARNAUBAS 600;PASSARE;60743780;FORTALEZA;CE;
05058628000161;RESIDENCIAL HENRIQUE JORGE;R MANAUS 757;HENRIQUE JORGE;60526200;FORTALEZA;CE;
05065293000109;CONDOMINIO RESIDENCIAL MORADA DO BOSQUE;AV FR CIRILO 4749;MESSEJANA;60840285;FORTALEZA;CE;
05075709000170;CONDOMINIO ED MAQUINOR;R CAP DAKIR 422;AT DA BALANCA;60851460;FORTALEZA;CE;
05075720000130;CONDOMINIO THEBAS;R JOAQUIM VIANA BARBOSA 240;CIDADE DOS FUNCIONARIOS;60822495;FORTALEZA;CE;
05075780000152;DUNAS HILL RESIDENCE;R ZUCA ACCIOLY 450;MANOEL DIAS BRANCO;60191335;FORTALEZA;CE;
05077306000160;CONDOMINIO IRMA DULCE;R ESPERANTO 546;VL UNIAO;60410622;FORTALEZA;CE;
05085885000192;CONDOMINIO ED CREVILARO;R EUCLIDES ONOFRE DE SOUZA 345;SAPIRANGA;60833252;FORTALEZA;CE;
05085939000110;CONDOMINIO CABO FRIO RESIDENCE;R GRANJA SAO FRANCISCO 640;JOSE DE ALENCAR;60830155;FORTALEZA;CE;
05092224000194;CONDOMINIO RESIDENCIAL COQUEIROS VILLAGE;R LUIS ANDRE 303;LGA REDONDA;60832480;FORTALEZA;CE;
05095068000115;CONDOMINIO ED SABIA;R JULIO CESAR 285;BENFICA;60020080;FORTALEZA;CE;
05097352000120;CONDOMINIO DO NORDESTE PLAZA SHOPPING;R JOSE HIPOLITO 550;MESSEJANA;60871170;FORTALEZA;CE;
05101997000190;CONDOMINIO DO ED VILA DE IRACEMA;R DOS TABAJARAS 138;PR DE IRACEMA;60060510;FORTALEZA;CE;
05106032000190;EDIFICIO GENY;R AZEVEDO BOLAO 849;PRQ ARAXA;60450675;FORTALEZA;CE;
05106366000163;CONDOMINIO RESIDENCIAL VIVENDAS DO LAGO;R VSC DE BARBACENA 740;CIDADE DOS FUNCIONARIOS;60822488;FORTALEZA;CE;
05116456000135;CONDOMINIO ED GOLDEN PLACE;R GEN TERTULIANO POTIGUARA 272;ALDEOTA;60135280;FORTALEZA;CE;
05117079000159;RESIDENCIAL RAIMUNDO GIRAO;AV PRUDENTE BRASIL 633 16 BLOCOS DE A ATE R;PASSARE;60743770;FORTALEZA;CE;
05128051000117;CONDOMINIO ED EVANDRO ALBUQUERQUE;R DRA SOCORRO AZEVEDO 140;ENG LUCIANO CAVALCANTE;60810400;FORTALEZA;CE;
05132621000142;CONDOMINIO ED SAN REMO;AV MNS TABOSA 1580;MEIRELES;60165068;FORTALEZA;CE;
05134468000192;EDIFICIO RESIDENCIAL ALTAMYRA;R ARARIPE PRATA 464;PARANGABA;60720350;FORTALEZA;CE;
05136653000116;CONDOMINIO ED ANA;R PE MATOS SERRA 140;FATIMA;60040290;FORTALEZA;CE;
05141116000164;RESIDENCIAL ANTONIO MARTINS FILHO;R PE PEDRO DE ALENCAR 1465;PAUPINA;60872560;FORTALEZA;CE;
05143075000145;CONDOMINIO GREEN VISION;AV JOSE LEON 2140;CIDADE DOS FUNCIONARIOS;60822676;FORTALEZA;CE;
05143914000125;CONDOMINIO ED MARIA LUIZA ARY;R CIRO MONTEIRO 249;CAMBEBA;60822285;FORTALEZA;CE;
05144280000125;CONDOMINIO ED PROF GLAUCO LOBO;R CANUTO DE AGUIAR 500;MEIRELES;60160120;FORTALEZA;CE;
05150468000186;EDIFICIO RAQUEL DE QUEIROZ;R MARGARIDA QUEIROS 765;CIDADE DOS FUNCIONARIOS;60822530;FORTALEZA;CE;
05157452000103;CENTRO EMPRESARIAL R B;AV ANTONIO SALES 1885;DIONISIO TORRES;60135203;FORTALEZA;CE;
05168204000150;CONDOMINIO RESIDENCIAL FRANCISCA RANGEL;R FRANCISCA RANGEL 174;PARQUELANDIA;60455390;FORTALEZA;CE;
05192427000152;CONDOMINIO RESIDENCIAL ATALAIA II;R AMANCIO PEREIRA 400;PASSARE;60861770;FORTALEZA;CE;
05194629000133;CONDOMINIO ED ANA KARINE;R CEL ALVES TEIXEIRA 1604;DIONISIO TORRES;60135208;FORTALEZA;CE;
05196853000164;CONDOMINIO ED HAMILTON NOGUEIRA;AV DES MOREIRA 245;MEIRELES;60170055;FORTALEZA;CE;
05196888000101;EDIFICIO ROTTERDAM;R CARLOS VASCONCELOS 450;MEIRELES;60115170;FORTALEZA;CE;
05206443000157;CONDOMINIO SHOPPING BENFICA;R CARAPINIMA 2200;BENFICA;60015290;FORTALEZA;CE;
05213482000181;EDIFICIO BROOKSVILLE;R CEL JUCA 1000;ALDEOTA;60170288;FORTALEZA;CE;
05215427000120;RESIDENCIAL DAMAS;R MATOS VASCONCELOS 1358;BELA VISTA;60442103;FORTALEZA;CE;
05216042000188;CONDOMINIO RESIDENCIAL DOS JATOBAS;R DOS JATOBAS 363;PASSARE;60743840;FORTALEZA;CE;
05216085000163;CONDOMINIO ED VILLA SIENA;R BARBOSA DE FREITAS 820;MEIRELES;60170020;FORTALEZA;CE;
05218923000138;CONDOMINIO ALABAMA;R GUSTAVO AUGUSTO LIMA SN;PATRIOLINO RIBEIRO;60810330;FORTALEZA;CE;
05220010000156;CONDOMINIO SPAZZIO II;R DR JOAQUIM FROTA 1060;JOSE DE ALENCAR;60830132;FORTALEZA;CE;
05228641000111;CONDOMINIO DO EDIFCIO IRACEMA TRAVEL SERVICE;AV ALM BARROSO 734;PR DE IRACEMA;60060440;FORTALEZA;CE;
05228709000162;CONDOMINIO ED FRANCISQUINHA CRUZ;R FRANKLIN TAVORA 174;CENTRO;60150110;FORTALEZA;CE;
05234553000122;CONDOMINIO ED SAN ISIDRO;R SEN POMPEU 2030;JOSE BONIFACIO;60025001;FORTALEZA;CE;
05239295000177;CONDOMINIO RESIDENCIAL ED AMERICAN GARDEN;R CARLOS CAMARA 1788;DAMAS;60425810;FORTALEZA;CE;
05241649000118;RESIDENCIAL PAULO MACHADO;AV BENJAMIM BRASIL 1080;MONDUBIM;60711442;FORTALEZA;CE;
05243788000180;CONDOMINIO ED LUXEMBURGO;R VICENTE LEITE 1481;ALDEOTA;60170151;FORTALEZA;CE;
05244073000142;CONDOMINIO ED FRATELLI;R DOS ARARIUS 200;PR DE IRACEMA;60060320;FORTALEZA;CE;
05250761000115;CONDOMINIO SAINTS GARDENS;R JOSE LEON 2740;CID DOS FUNCIONARIOS;60822670;FORTALEZA;CE;
05251193000177;EDIFICIO MILLENIUM;R EUCLIDES ONOFRE DE SOUZA 301;SAPIRANGA;60833252;FORTALEZA;CE;
05255736000124;CONDOMINIO ED RESIDENCIAL SAINT JAMES PARK;R ALUYSIO SORIANO ADERALDO 50;COCO;60192330;FORTALEZA;CE;
05256514000126;CONDOMINIO ED IPE;R JULIO CESAR 301;BENFICA;60020080;FORTALEZA;CE;
05259248000195;EDIFICIO CEL ANTONIO LEITE FURTADO;R PROF VALDIVINO 127;SABIAGUABA;60835275;FORTALEZA;CE;
05262002000172;CONDOMINIO RESIDENCIAL PARAISO VERDE;R LUIS GIRAO 1391;CAMBEBA;60822160;FORTALEZA;CE;
05268043000176;CONDOMINIO FLOWER RESIDENCE;R CLEITON HELAIDE PIMENTA 815;JD DAS OLIVEIRAS;60821410;FORTALEZA;CE;
05269679000132;RESIDENCIAL DOS LIRIOS;R BEATRIZ 450 BLOCOS DE 1 A 7;BARROSO;60862700;FORTALEZA;CE;
05270700000110;ALESSANDRIA;R JOAQUIM VIANA BARBOSA 255;CIDADE DOS FUNCIONARIOS;60822495;FORTALEZA;CE;
05272905000134;RESIDENCIAL SOL POENTE;AV JUSCELINO KUBITSCHEK 3371;PASSARE;60861635;FORTALEZA;CE;
05273660000160;CONDOMINIO DO ED MALAGA;R BENTO ALBUQUERQUE 800;COCO;60192060;FORTALEZA;CE;
05277328000173;EDIFICIO TOULOUSE;R CAETANO XIMENES ARAGAO 403;ENG LUCIANO CAVALCANTE;60813620;FORTALEZA;CE;
05279918000135;CONDOMINIO PRAIAS DO CEARA;AV CESAR CALS 1300;VICENTE PINZON;60182035;FORTALEZA;CE;
05285073000190;CONDOMINIO ED GALAPAGOS;R ANA BILHAR 1441;VARJOTA;60175224;FORTALEZA;CE;
05287315000185;EDIFICIO ATLANTIC MAX SPACE;R SILVA PAULET 736;MEIRELES;60120020;FORTALEZA;CE;
05287785000149;RESIDENCIAL PARQUE DAS DAMAS II;R OSCAR BEZERRA DE ARAUJO 250;MONTESE;60425720;FORTALEZA;CE;
05288021000178;CONDOMINIO RESIDENCIAL NOVO MILENIO I;R JOAQUIM VIANA BARBOSA 249;CIDADE DOS FUNCIONARIOS;60822495;FORTALEZA;CE;
05288158000122;CONDOMINIO HORTENCIAS II;R CLODOALDO ARRUDA 700;MESSEJANA;60830650;FORTALEZA;CE;
05288235000144;CENTRO COML DR GUSTAVO BRAGA;AV JOAO PESSOA 4717;DAMAS;60425680;FORTALEZA;CE;
05290190000142;CONDOMINIO ED FOZ DO SIRIA;R GUSTAVO SAMPAIO 1351;PARQUELANDIA;60455001;FORTALEZA;CE;
05299913000174;CONDOMINIO ED ARUA;AV NORTE 2800;ENG LUCIANO CAVALCANTE;60813670;FORTALEZA;CE;
05304925000140;CONDOMINIO ED MAISON CHEVERNY;R JORN CESAR MAGALHAES 666;PATRIOLINO RIBEIRO;60810140;FORTALEZA;CE;
05304942000187;CONDOMINIO IMPERIAL GARDEN;R CEL ALUISIO BORBA 132;ENG LUCIANO CAVALCANTE;60813730;FORTALEZA;CE;
05307010000198;RESIDENCIAL JAIME FRANCA;AV NORTE 2930 ALPHA VILLAGE;ENG LUCIANO CAVALCANTE;60813670;FORTALEZA;CE;
05307639000138;CONDOMINIO DO RESIDENCIAL ANA BILHAR;R ANA BILHAR 602;MEIRELES;60160110;FORTALEZA;CE;
05311857000146;CONDOMINIO ED TEREZINHA;AV BR DE STUDART 204;MEIRELES;60120000;FORTALEZA;CE;
05321585000165;CONDOMINIO ED BRISA DO SUL;R FELIPE NERY 1002;PATRIOLINO RIBEIRO;60810310;FORTALEZA;CE;
05326848000129;EDIFICIO ANA CAROLINA;R REPUBLICA DO LIBANO 321;MEIRELES;60160140;FORTALEZA;CE;
05329024000102;CONDOMINIO CONJUNTO RESIDENCIAL PARQUE SANTOS DUMONT;AV SANTOS DUMONT 3665;ALDEOTA;60150165;FORTALEZA;CE;
05334188000128;CONDOMINIO SANTA CHIARA;R MARIA TOMASIA 1261;ALDEOTA;60150170;FORTALEZA;CE;
05336643000124;LA FONTAINE RESIDENCE;R JOAO CORDEIRO 1100;CENTRO;60110300;FORTALEZA;CE;
05341852000166;CONDOMINIO DO ED MONTICATINE;R DES LEITE ALBUQUERQUE 290;ALDEOTA;60150150;FORTALEZA;CE;
05343574000186;CONDOMINIO ED MARCHENA;R DR MARLIO FERNANDES 335;PATRIOLINO RIBEIRO;60810025;FORTALEZA;CE;
05348658000102;CONDOMINIO ANAVILHANAS;AV NORTE 1919 ALPHA VILLAGE;ENG LUCIANO CAVALCANTE;60813670;FORTALEZA;CE;
05353215000100;CONDOMINIO DO ED ILHA DO MEL;R PROF WILSON AGUIAR 380;EDSON QUEIROZ;60811590;FORTALEZA;CE;
05354223000170;RESIDENCIAL PARQUE MESSEJANA;R PE PEDRO DE ALENCAR 1564;PRQ STA MARIA;60873082;FORTALEZA;CE;
05355969000107;CONDOMINIO DO GUARANY RESIDENCE;R JOSE VILAR 540;MEIRELES;60125000;FORTALEZA;CE;
05359096000100;CONDOMINIO DO ED AGUA MARINHA;AV ANTONIO JUSTA 1888;MEIRELES;60165090;FORTALEZA;CE;
05379788000102;CONDOMINIO RESIDENCIAL MATIAS BECK;R MNS DANTAS 100;JACARECANGA;60010436;FORTALEZA;CE;
05381618000162;CONDOMINIO RESIDENCIAL LAKE VILLAGE;R C 55;EDSON QUEIROZ;60812340;FORTALEZA;CE;
05386890000135;CONDOMINIO BRISAS DO JACAREY II;R CHICO LEMOS 1405;PRQ IRACEMA;60824042;FORTALEZA;CE;
05388296000183;EDIFICIO PLACE ROYALE;R MARIA TOMASIA 170;ALDEOTA;60150170;FORTALEZA;CE;
05388435000179;RESIDENCIAL PASSARE;AV PRUDENTE BRASIL 1200;PASSARE;60743770;FORTALEZA;CE;
05389045000113;CONDOMINIO EDFICIO SILVER PLACE;R TIBURCIO CAVALCANTE 3030;DIONISIO TORRES;60125101;FORTALEZA;CE;
05397409000107;CONDOMINIO RESIDENCIAL BELA VISTA II;R FRANCISCO VILELA 357;BOA VISTA;60861140;FORTALEZA;CE;
05399386000170;CONDOMINIO CERVANTES RESIDENCE;R LEDA PORTO FREIRE 101 LT PARQUE DEL SOL;PRQ IRACEMA;60824020;FORTALEZA;CE;
05400078000117;CONDOMINIO EUROPA BOULEVARD;R BILL CARTAXO 1725;JOSE DE ALENCAR;60830125;FORTALEZA;CE;
05400100000129;EDIFICIO MONTSERRAT CONDOMINIUM;R CASIMIRO DE ABREU 460;PARANGABA;60710250;FORTALEZA;CE;
05403015000114;CONDOMINIO ED ZEN RESIDENCE;AV DA ABOLICAO 1894;MEIRELES;60165080;FORTALEZA;CE;
05407946000190;CONDOMINIO DO ED ILHA VERDE;R PROF WILSON AGUIAR 280;EDSON QUEIROZ;60811590;FORTALEZA;CE;
05413155000173;CONDOMINIO ED SANTIAGO DE COMPOSTELA;R CEL JUCA 330;MEIRELES;60170320;FORTALEZA;CE;
05423675000167;CONDOMINIO REMBRANDT RESIDENCE;R PEREIRA FILGUEIRAS 2122;ALDEOTA;60160194;FORTALEZA;CE;
05426117000155;SHOPPING ALAMANDA;R S LUIS 1085;HENRIQUE JORGE;60521082;FORTALEZA;CE;
05426781000102;CONDOMINIO SANDRA ALBUQUERQUE;R D SEBASTIAO LEME 378;FATIMA;60050160;FORTALEZA;CE;
05426813000161;CONDOMINIO ED LIRIO;R SILVA JATAHY 735;MEIRELES;60165070;FORTALEZA;CE;
05426858000136;EDIFICIO MONT SAINT MICHEL;R BARBOSA DE FREITAS 555;MEIRELES;60170020;FORTALEZA;CE;
05426886000153;CONDOMINIO ED STUDIO 1;R SILVA PAULET 205;MEIRELES;60120020;FORTALEZA;CE;
05433139000142;CONDOMINIO SOLAR DAS DUNAS;R MARCELINO LOPES SN;SAPIRANGA;60833075;FORTALEZA;CE;
05433566000120;EDIFICIO LENINGRADO;R DR JOSE LOURENCO 440;MEIRELES;60115280;FORTALEZA;CE;
05434993000123;CONDOMINIO ED CAIANA;R S GABRIEL 250;S JOAO DO TAUAPE;60135450;FORTALEZA;CE;
05440447000103;CONDOMINIO ED CONCEICAO CARNEIRO;R CARLOS RIBEIRO 531;FATIMA;60040420;FORTALEZA;CE;
05443552000198;CONDOMINIO ED CENTURY RESIDENCE;R CEL LINHARES 1516;ALDEOTA;60170075;FORTALEZA;CE;
05446377000192;EDIFICIO CARAVELLE RESIDENCE;AV DA ABOLICAO 4792;MUCURIPE;60165082;FORTALEZA;CE;
05449639000172;CONDOMINIO DO ED SAN RAPHAEL;R MNS BRUNO 3023;JOAQUIM TAVORA;60115046;FORTALEZA;CE;
05455654000123;CONDOMINIO ED LAS PALMAS;R G 1300;MANOEL DIAS BRANCO;60191070;FORTALEZA;CE;
05459596000106;EDIFICIO ITAGUA;R SILVA PAULET 1940;DIONISIO TORRES;60120385;FORTALEZA;CE;
05466140000173;CONDOMINIO RESIDENCIAL GRAMMY III;R GUSTAVO SAMPAIO 1099;PARQUELANDIA;60455001;FORTALEZA;CE;
05466185000148;CONDOMINIO SANTORINI;R JORGE SEVERIANO 1599;VL UNIAO;60420180;FORTALEZA;CE;
05471916000143;CONDOMINIO ED LEONIA;R CESAR CALS 1740;VICENTE PINZON;60183550;FORTALEZA;CE;
05475099000100;CONDOMINIO KARISYA;R RAFAEL TOBIAS 2727;JOSE DE ALENCAR;60830105;FORTALEZA;CE;
05483619000118;CONDOMINIO ONELIA REIS;R DR ZELITO PAMPLONA SN LT 10 Q 8;ANTONIO DIOGO;60182380;FORTALEZA;CE;
05490386000180;CONDOMINIO ED ATALANTA;R EFESIO 453;ENG LUCIANO CAVALCANTE;60811180;FORTALEZA;CE;
