00056113000109;CONDOMINIO ED CANNES;AV DA ABOLICAO 3659;MUCURIPE;60165085;FORTALEZA;CE;
00056114000153;CONDOMINIO ED NICE;AV DA ABOLICAO 3659;MUCURIPE;60165085;FORTALEZA;CE;
00057705000145;CONDOMINIO ED ANTONIO BENEDITO;R BR DO RIO BRANCO 3134;FATIMA;60025062;FORTALEZA;CE;
00058117000126;CONDOMINIO ED MORADA DAS ACACIAS B QUADRA 9;R FRANCISCO NOGUEIRA 250;CAJAZEIRAS;60864330;FORTALEZA;CE;
00060299000170;CONDOMINIO ED EXUPERY;AV AGUANAMBI 1505;FATIMA;60055401;FORTALEZA;CE;
00061198000113;CONDOMINIO ED JAVA;R PROF ANACLETO 50;PARQUELANDIA;60450360;FORTALEZA;CE;
00061399000110;CONDOMINIO ROGACIANO LEITE I;R DRA SOCORRO AZEVEDO 150;ENG LUCIANO CAVALCANTE;60810400;FORTALEZA;CE;
00064680000107;CONDOMINIO ED ALIPIO GOMES;R ESVAO PINHEIRO 4195;S JOAO DO TAUAPE;60120310;FORTALEZA;CE;
00066056000149;DIETRICH;R JOAQUIM NABUCO 825;ALDEOTA;60125055;FORTALEZA;CE;
00067833000170;CONDOMINIO ED QUEBEC;R OSVALDO CRUZ 635;MEIRELES;60125150;FORTALEZA;CE;
00071755000187;CONDOMINIO DO ED RESIDENCIAL PRAIA;R DA PAZ 215;MUCURIPE;60165180;FORTALEZA;CE;
00074142000101;CONDOMINIO ED RITZ;R PE VALDEVINO 1500;JOAQUIM TAVORA;60135040;FORTALEZA;CE;
00075313000109;CONDOMINIO ED SILVINHA;R CEL ALVES TEIXEIRA 1130 AP 202;JOAQUIM TAVORA;60130000;FORTALEZA;CE;
00075662000120;CONDOMINIO DO ED FREITAS;R ANDRADE FURTADO 1060;COCO;60192072;FORTALEZA;CE;
00078401000164;CONDOMINIO ED CRALMELO;R TIBURCIO CAVALCANTE 721;MEIRELES;60125100;FORTALEZA;CE;
00078403000153;CONDOMINIO ED RESIDENCIAL BARAO DE MESQUITA;AV DA UNIVERSIDADE 1949;BENFICA;60020180;FORTALEZA;CE;
00078759000197;CONDOMINIO DO ED ELO 06;R BENTO ALBUQUERQUE 1720;COCO;60192055;FORTALEZA;CE;
00080868000149;CONDOMINIO DOS ED MONICA VASCONCELOS E ANA TEREZA;R TOMAS ACIOLI 33 55;JOAQUIM TAVORA;60135180;FORTALEZA;CE;
00083158000172;CONDOMINIO ED ORLY;R SILVA JATAHY 631;MEIRELES;60165070;FORTALEZA;CE;
00084942000103;CONDOMINIO ED CASA GRANDE;R DR GILBERTO STUDART 1313;COCO;60192095;FORTALEZA;CE;
00088183000149;EDIFICIO SOL NASCENTE;R BENTO ALBUQUERQUE 1750 HALL;COCO;60192055;FORTALEZA;CE;
00088762000191;CONDOMINIO ED VALDIRA;R ARTUR DE CARVALHO 277;FATIMA;60410710;FORTALEZA;CE;
00090694000103;CONDOMINIO ED JANDAIA;R JAIME BENEVOLO 1888;FATIMA;60411130;FORTALEZA;CE;
00091376000159;SUMARE;R ILDEFONSO ALBANO 1519;ALDEOTA;60115125;FORTALEZA;CE;
00091958000135;EDIFICIO FORT WAYNE;R D LINO 188;PARQUELANDIA;60450285;FORTALEZA;CE;
00092852000156;CONDOMINIO RENATA JATAHY;R FISC VIEIRA 3800;S JOAO DO TAUAPE;60120085;FORTALEZA;CE;
00094394000194;CONDOMINIO ED LUZERNE;R VILEBALDO AGUIAR 760;PAPICU;60190780;FORTALEZA;CE;
00097150000165;CONDOMINIO DO ED OLIMPUS;AV SANTOS DUMONT 5780;COCO;60192018;FORTALEZA;CE;
00100392000160;CONDOMINIO EDITE MIRANDA;R JOAQUIM DEODATO 209;CENTRO;60150240;FORTALEZA;CE;
00103313000175;CONDOMINIO DO ED CASCAIS;R OSVALDO CRUZ 280;MEIRELES;60125150;FORTALEZA;CE;
00103674000111;CONDOMINIO DO ED ARAGUAIA;AV PONTES VIEIRA 2600;DIONISIO TORRES;60135238;FORTALEZA;CE;
00105665000160;CONDOMINIO BOULEVARD 13 DE MAIO;R LUCIANO MAGALHAES 380;FATIMA;60415150;FORTALEZA;CE;
00106482000169;CONDOMINIO VILLAGE BELLES MAISONS;AV ENG LEAL LIMA VERDE 1860;JOSE DE ALENCAR;60830055;FORTALEZA;CE;
00106485000100;CONDOMINIO ED MARTINS DOURADO;AV VSC DO RIO BRANCO 2650;FATIMA;60055364;FORTALEZA;CE;
00113246000170;CONDOMINIO ED OLIMPIO;R DR PEDRO TELES 101;FATIMA;60055320;FORTALEZA;CE;
00113725000196;CONDOMINIO ED ASSEMBLY RESIDENCE;R LEONARDO MOTA 2745;DIONISIO TORRES;60170176;FORTALEZA;CE;
00115282000172;CONDOMINIO RESIDENCIAL ITAPOAN II;R MNS AGOSTINHO 803;VL PERI;60730182;FORTALEZA;CE;
00116267000149;CONDOMINIO JARDIM DE NAZARE;R FR VIDAL 2045 2083 2093;S JOAO DO TAUAPE;60120100;FORTALEZA;CE;
00119706000177;CONDOMINIO VILLAGE ST PAUL;R PE JANUARIO CAMPOS 68;PRQ MANIBURA;60821705;FORTALEZA;CE;
00120236000161;CONDOMINIO DO ED JOIA E ACAPULCO;AV DES MOREIRA 40;MEIRELES;60170000;FORTALEZA;CE;
00124112000154;CONDOMINIO ED SAINT LOUIS;R ALMEIDA PRADO 610;PAPICU;60176085;FORTALEZA;CE;
00124116000132;CONDOMINIO ED VANESSA;AV DES MOREIRA SN;MEIRELES;60170000;FORTALEZA;CE;
00124121000145;MEDICAL CENTER;R CEL LINHARES 950;ALDEOTA;60170075;FORTALEZA;CE;
00126864000154;CONDOMINIO ED VILLA VERDE;R CARLOS VASCONCELOS 2889;JOAQUIM TAVORA;60115044;FORTALEZA;CE;
00126881000191;CONDOMINIO ED AYRTON FERNANDES;R D EXPEDITO LOPES 2595;DIONISIO TORRES;60135410;FORTALEZA;CE;
00129407000113;HARBOUR VILLAGE;R LEONARDO MOTA 1356;ALDEOTA;60170041;FORTALEZA;CE;
00135637000195;CONDOMINIO ED REC DAS ACACIAS III;R FRANCOIS TELES DE MENEZES 50;FATIMA;60415110;FORTALEZA;CE;
00144647000197;CONDOMINIO ED PALMA;R ANDRADE FURTADO 2277;COCO;60192085;FORTALEZA;CE;
00148548000183;ITAGUACU;R OSVALDO CRUZ 1380;ALDEOTA;60125048;FORTALEZA;CE;
00154035000185;CONDOMINIO ITAPIPOCA;R DR GILBERTO STUDART 1500;COCO;60192095;FORTALEZA;CE;
00156073000177;CONDOMINIO ED SANTA RITA;R CARLOS SEVERO 105;FARIAS BRITO;60011100;FORTALEZA;CE;
00157478000120;CONDOMINIO ED MONTPELLIERR;R FRANCISCO XEREZ 581;PATRIOLINO RIBEIRO;60810035;FORTALEZA;CE;
00157482000198;CONDOMINIO DO ED STYLO;R ALM RUFINO 1515;MONTESE;60420312;FORTALEZA;CE;
00159948000194;CONDOMINIO ED MAGUARY;R DEP JOAO PONTES 1287;FATIMA;60040430;FORTALEZA;CE;
00160345000102;CONDOMINIO DO ED ANTONIUS III;R CANUTO DE AGUIAR 515;MEIRELES;60160120;FORTALEZA;CE;
00163159000127;CONDOMINIO ED JUREMA;AV ANTONIO JUSTA 2778;MEIRELES;60165090;FORTALEZA;CE;
00164720000192;ANTONIO JOSE;R MONSENHOR BRUNO 1697;ALDEOTA;60115191;FORTALEZA;CE;
00167926000176;CONDOMINIO BELA VISTA;R PAULO FIRMEZA 755;S JOAO DO TAUAPE;60130420;FORTALEZA;CE;
00174195000196;CONDOMINIO ED BELLE VILLE;R BARBOSA DE FREITAS 2560;DIONISIO TORRES;60170174;FORTALEZA;CE;
00179511000112;CONDOMINIO ARVOREDO RESIDENCE;AV CEL MIGUEL DIAS 1411;PATRIOLINO RIBEIRO;60810160;FORTALEZA;CE;
00184229000123;CONDOMINIO MULTI FAMILIAR AUTRAN FILHO;R CONRADO CABRAL 650;MTE CASTELO;60325440;FORTALEZA;CE;
00185220000137;CONDOMINIO DO ED LUZON RESIDENCE SERVICE;R SILVA JATAHY 942;MEIRELES;60165070;FORTALEZA;CE;
00187687000116;EDIFICIO COML P G CENTER II;R S LUIS 609;HENRIQUE JORGE;60521082;FORTALEZA;CE;
00189411000177;CONDOMINIO ED CASTELGANDOLFO;R DR GILBERTO STUDART 920;COCO;60192105;FORTALEZA;CE;
00193827000169;CONDOMINIO SALINAS;R PROF JACINTO BOTELHO 120;PATRIOLINO RIBEIRO;60810050;FORTALEZA;CE;
00194219000179;CENTRO COML DO CDM SAN THIAGO;AV ANTONIO SALES 2155;DIONISIO TORRES;60135203;FORTALEZA;CE;
00204975000131;EDIFICIO COLINAS DE ROMA;R BARBALHA 300;MEIRELES;60165100;FORTALEZA;CE;
00211613000178;CONDOMINIO DO ED SANTO PATRICK S;R CEL JUCA 315;MEIRELES;60170320;FORTALEZA;CE;
00211614000112;ORLANDO BEZERRA;R MARCOS MACEDO 644;ALDEOTA;60150190;FORTALEZA;CE;
00212526000135;CONDOMINIO ED XENOFONTE;R ASSUNCAO 911;JD CEARENSE;60712020;FORTALEZA;CE;
00217949000148;CONDOMINIO ED LISBOA;AV DA UNIVERSIDADE 3264 HALL;BENFICA;60020181;FORTALEZA;CE;
00217951000117;CONDOMINIO NADJA AGUIAR;R NUNES VALENTE 2491;DIONISIO TORRES;60125071;FORTALEZA;CE;
00217952000161;CONDOMINIO ED GERIBA;R JOAQUIM NABUCO 275;MEIRELES;60125120;FORTALEZA;CE;
00234723000155;CONDOMINIO RESIDENCIAL RAQUEL DE QUEIROZ;R STA QUITERIA 366;PARREAO;60410330;FORTALEZA;CE;
00239056000101;CONDOMINIO TELEFONICO JOAO PAULO II;R MUNDICA PAULA 681;ITAOCA;60421410;FORTALEZA;CE;
00241175000190;CONDOMINIO DO ED GERMANO PONTE;R OSVALDO CRUZ SN;MEIRELES;60125150;FORTALEZA;CE;
00241304000140;CONDOMINIO ED RESIDENCIAL AUGUSTO RUSCH;R ANDRE CHAVES 100;PARREAO;60410341;FORTALEZA;CE;
00246816000108;KHALIL GIBRAN;R DR JOSE LOURENCO 1951;ALDEOTA;60115281;FORTALEZA;CE;
00247729000167;CONDOMINIO ED SAINT GERMAIN;R VICENTE LEITE 630;MEIRELES;60170150;FORTALEZA;CE;
00252683000174;CONDOMINIO ED GOMEZ;R JOSE VILAR 2671;DIONISIO TORRES;60125001;FORTALEZA;CE;
00252763000120;CONDOMINIO ED MIGUEL CALMON;R CEL ALVES TEIXEIRA 1716;DIONISIO TORRES;60135208;FORTALEZA;CE;
00255222000155;CONDOMINIO DO ED TERRACES LA MAISON;R OSVALDO CRUZ 250;MEIRELES;60125150;FORTALEZA;CE;
00257359000149;CONDOMINIO ED NONSENHOR BRUNO;R MNS BRUNO 630 HALL;MEIRELES;60115190;FORTALEZA;CE;
00257479000146;CONDOMINIO ED MNS BRUNO;R MNS BRUNO 630 HALL;MEIRELES;60115190;FORTALEZA;CE;
00260254000149;RIO VOUGA;R JOAQUIM NABUCO 1840;ALDEOTA;60125055;FORTALEZA;CE;
00262948000115;CONDOMINIO ED PEGASUS;R CANUTO DE AGUIAR 900;MEIRELES;60160120;FORTALEZA;CE;
00263123000115;CONDOMINIO RESIDENCIAL PHILADELPHIA;R BRAZ DE FRANCESCO 23;PRES KENNEDY;60355633;FORTALEZA;CE;
00268942000155;CONDOMINIO ED SIRIARA;R VSC DE MAUA 267;MEIRELES;60125160;FORTALEZA;CE;
00272364000120;CONDOMINIO ED ANCHIETA;R JOSE VILAR 2694;DIONISIO TORRES;60125001;FORTALEZA;CE;
00276805000162;PATRICIA;R ANTONIO AUGUSTO 1451;ALDEOTA;60110371;FORTALEZA;CE;
00276806000107;EDIFICIO RESIDENCIAL REI DAVI;R PEREIRA VALENTE 738;MEIRELES;60160250;FORTALEZA;CE;
00282310000146;CONDOMINIO MARIA HELENA;AV SANTOS DUMONT 925 BL C AP 103;CENTRO;60150160;FORTALEZA;CE;
00282313000180;ANDORRA CDM RESIDENCIAL;R JOSE VILAR SN;MEIRELES;60125000;FORTALEZA;CE;
00284833000121;CONDOMINIO RESIDENCIAL GRAMMY;R GUSTAVO SAMPAIO 2330;PARQUELANDIA;60455001;FORTALEZA;CE;
00289738000110;CONDOMINIO ED ALLET S;R FR MANSUETO 303;MUCURIPE;60175185;FORTALEZA;CE;
00293689000190;CONDOMINIO DO ED ATLANT S;R FRANCISCO TEIXEIRA DE ALCANTARA 50;ANTONIO DIOGO;60182360;FORTALEZA;CE;
00293905000105;CONDOMINIO ED MANAUS;R JOSE AURELIO CAMARA 381;PICI;60440546;FORTALEZA;CE;
00303899000111;CONDOMINIO AVENIDA SHOPPING OFFICE;AV D LUIS 300 ADMINISTRACAO;ALDEOTA;60160196;FORTALEZA;CE;
00305106000101;CONDOMINIO ED JANGADA;VL PRES KENNEDY 1000;BELA VISTA;60441414;FORTALEZA;CE;
00307756000188;EDIFICIO DO CDM RESIDENCIAL TAINAH;R PROF DIAS DA ROCHA 370;MEIRELES;60170310;FORTALEZA;CE;
00309624000195;CONDOMINIO ED SAN DIEGO;R ANDRADE FURTADO 601;COCO;60192070;FORTALEZA;CE;
00310666000146;EDIFICIO TORREMOLINOS;R DOS POTIGUARAS 1315;PR DE IRACEMA;60060500;FORTALEZA;CE;
00317519000106;CONDOMINIO ED ISAAC AMARAL;R ISAAC AMARAL 630;DIONISIO TORRES;60130120;FORTALEZA;CE;
00321450000186;FORMA I;R MARECHAL RONDON 281;ALDEOTA;60175060;FORTALEZA;CE;
00321453000110;CONDOMINIO ED JOAO PAULO I;R RODRIGUES JUNIOR 1362;CENTRO;60060001;FORTALEZA;CE;
00321456000153;DO TORRES;R TORRES CAMARA 740;ALDEOTA;60150060;FORTALEZA;CE;
00321459000197;EDIFICIO FORMA V;AV BR DE STUDART 2441;DIONISIO TORRES;60120375;FORTALEZA;CE;
00321461000166;EDIFICIO RESIDENCIAL YAYA ROSA;R PAULA BARROS 337;MEIRELES;60170060;FORTALEZA;CE;
00324311000106;CONDOMINIO ED PTO ANTONIO BANDEIRA;AV PTO ANTONIO BANDEIRA 3231;VICENTE PINZON;60182300;FORTALEZA;CE;
00325887000198;CONDOMINIO ED PORTE DES LILAS;R CANUTO DE AGUIAR 1212;MEIRELES;60160120;FORTALEZA;CE;
00325891000156;CONDOMINIO MORADA DAS VERBENAS;R S BERNARDO 214;ALVARO WEYNE;60335555;FORTALEZA;CE;
00327936000121;EDIFICIO JOAQUIM FROTA DE HOLANDA;R EMIDIO LOBO 100;PAPICU;60176090;FORTALEZA;CE;
00327937000176;CONDOMINIO ED JOSE VILAR;R JOSE VILAR 430;MEIRELES;60125000;FORTALEZA;CE;
00332815000178;CONDOMINIO DO ED CASTELLANI;R DR FRANCISCO MATOS 588;COCO;60192240;FORTALEZA;CE;
00344207000183;EDIFICIO GRAND PLACE;R TIBURCIO CAVALCANTE 600;MEIRELES;60125100;FORTALEZA;CE;
00346459000141;CONDOMINIO ED MASTER NAVEGANTES;R DA PAZ 470;MUCURIPE;60165180;FORTALEZA;CE;
00350128000185;CONDOMINIO DO ED MARANATA II;R CARLOS VASCONCELOS 287;MEIRELES;60115170;FORTALEZA;CE;
00350238000147;GRAMADO;R MARECHAL RONDON 330;ALDEOTA;60175060;FORTALEZA;CE;
00354406000172;CONDOMINIO RESIDENCIAL SOL NASCENTE II;R MARIO MAMEDE 383;FATIMA;60415000;FORTALEZA;CE;
00355319000130;BONNEVILLE;R VISCONDE DE MAUA 1616;ALDEOTA;60125058;FORTALEZA;CE;
00357573000177;CONDOMINIO ED DANIEL CARLOS;R DO CANAL 120;S GERARDO;60325130;FORTALEZA;CE;
00362708000192;CONDOMINIO ED PAUL GAUGUIN;AV BEIRA MAR 2300;MEIRELES;60165120;FORTALEZA;CE;
00368095000109;CONDOMINIO ED ROYAN;R DR FRANCISCO MATOS 100;PAPICU;60176135;FORTALEZA;CE;
00369898000170;EDIFICIO SOLAR DEBRET;R PASCOAL DE CASTRO ALVES 301;VICENTE PINZON;60181225;FORTALEZA;CE;
00369901000155;CONDOMINIO DO ED BENER;R JORGE ACURCIO 600;VL UNIAO;60410802;FORTALEZA;CE;
00371536000113;CONDOMINIO DO ED ICAPUI;R PASCOAL DE CASTRO ALVES 926;VICENTE PINZON;60181225;FORTALEZA;CE;
00375023000180;EDIFICIO CRISTAL IV;R ANTONIO LIMA 188;MEIRELES;60115270;FORTALEZA;CE;
00375769000194;CONDOMINIO ED CAIMAN;AV ENG ALBERTO SA 153;PAPICU;60175395;FORTALEZA;CE;
00378538000134;CONDOMINIO ED SEN VIRGILIO TAVORA;R DR JOSE LOURENCO 435;MEIRELES;60115280;FORTALEZA;CE;
00378540000103;CONDOMINIO ED ABDORAL RABELO;AV ROGACIANO LEITE 55;PATRIOLINO RIBEIRO;60810001;FORTALEZA;CE;
00387454000167;CONDOMINIO ED ELLERY;AV DA ABOLICAO 2667 PREDIO;MEIRELES;60165075;FORTALEZA;CE;
00387619000109;CLOVIS HOLANDA;R OSVALDO CRUZ 2006;ALDEOTA;60125048;FORTALEZA;CE;
00387622000114;LUCIANA;R FR MANSUETO 1460;ALDEOTA;60175082;FORTALEZA;CE;
00388101000181;NOROESTE LOTUS CENTER;AV SEN FERNANDES TAVORA 1845;HENRIQUE JORGE;60510291;FORTALEZA;CE;
00388824000180;RESIDENCIAL LEODEGARIO PINHO;R MARIA MIRIAN FERREIRA DE SOUZA 88;PRES KENNEDY;60355642;FORTALEZA;CE;
00390072000192;CONDOMINIO ED KAICARA;R VICENTE LEITE 497 AND 9;MEIRELES;60170150;FORTALEZA;CE;
00392462000100;CONDOMINIO ED COIMBRA;R TAVARES COUTINHO 815;VARJOTA;60160130;FORTALEZA;CE;
00393706000160;GEORGIA;R FONSECA LOBO 50;ALDEOTA;60175020;FORTALEZA;CE;
00394441000115;CONDOMINIO ED TURIM;R CNSO TRISTAO 373;JOSE BONIFACIO;60050101;FORTALEZA;CE;
00396810000109;CONDOMINIO DO ED PEDRO LAZAR;R PEREIRA VALENTE 111;MEIRELES;60160250;FORTALEZA;CE;
00396896000170;CONDOMINIO ED VERA CRUZ;R SILVA JATAHY 1155;MEIRELES;60165070;FORTALEZA;CE;
00408477000100;CONDOMINIO SAMUEL UCHOA;R SAMUEL UCHOA 1199;DAMAS;60425796;FORTALEZA;CE;
00408478000155;CONDOMINIO RESIDENCIAL CASTELAO II;R PROFA STELLA COCHRANE 155;ITAPERI;60743670;FORTALEZA;CE;
00408479000108;CONDOMINIO PETIT PALAIS;R CARLOS VASCONCELOS 355;MEIRELES;60115170;FORTALEZA;CE;
00408487000146;CONDOMINIO ED MODIGLIANI;R CEL JUCA 398;MEIRELES;60170320;FORTALEZA;CE;
00410678000142;SANTA BARBARA;R TIBURCIO CAVALCANTE 1490;ALDEOTA;60125045;FORTALEZA;CE;
00418246000188;CONDOMINIO ED VICENTE DE CASTRO NETO;AV MNS TABOSA 111 SL 11 13 AND 1;PR DE IRACEMA;60165011;FORTALEZA;CE;
00418248000177;CONDOMINIO ED MONTPARNASSE;R BR DE ARATANHA 1333;FATIMA;60050125;FORTALEZA;CE;
00419201000128;CATARINA RIBEIRO;R MONSENHOR BRUNO 1702;ALDEOTA;60115191;FORTALEZA;CE;
00421476000104;CONDOMINIO ED DIANA S;R SILVA PAULET 3200;DIONISIO TORRES;60120385;FORTALEZA;CE;
00421601000178;CONDOMINIO TELEFONICO SANTA HELENA;AV DESENBARCADOR GONZAGA 1255;CIDADE FUNCIONARIO;60823000;FORTALEZA;CE;
00423469000133;CONDOMINIO ED STAR CITY I;AV SANTOS DUMONT 6997;PAPICU;60175057;FORTALEZA;CE;
00423471000102;CONDOMINIO ED STAR CITY II;AV SANTOS DUMONT 6911;PAPICU;60175057;FORTALEZA;CE;
00426796000149;CONDOMINIO DO ED MEDEIROS MAGALHAES;AV DIOGUINHO 1990;ANTONIO DIOGO;60182414;FORTALEZA;CE;
00433640000195;CONDOMINIO ED ARABAIANA;R FISC VIEIRA 3781;S JOAO DO TAUAPE;60120085;FORTALEZA;CE;
00437997000141;CONDOMINIO DO ED MEDEIROS MAGALHAES;AV DIOGUINHO 1990;ANTONIO DIOGO;60182414;FORTALEZA;CE;
00440987000165;CONDOMINIO ED MARSEILLE;R JOAO NOGUEIRA BORGES 290;PR DO FUTURO;60182440;FORTALEZA;CE;
00441144000183;CONDOMINIO ED ZAHLE;R CARLOS VASCONCELOS 510;MEIRELES;60115170;FORTALEZA;CE;
00444196000103;CONDOMINIO ED JEQUITIBA;R CANUTO DE AGUIAR 849;MEIRELES;60160120;FORTALEZA;CE;
00445479000170;CONDOMINIO ED ANDRE DALL OLIO;TV JACINTO 37;MEIRELES;60115090;FORTALEZA;CE;
00452936000153;MAISON PLATINE;R ANTONIO AUGUSTO 1397;ALDEOTA;60110371;FORTALEZA;CE;
00465675000106;CONDOMINIO ED RESIDENCE TOUR D ARGENT;R JOAQUIM NABUCO 201;MEIRELES;60125120;FORTALEZA;CE;
00474495000190;CONDOMINIO ED JOAO BATISTA RIOS;R MNS BRUNO 2428;JOAQUIM TAVORA;60115046;FORTALEZA;CE;
00479161000100;CONDOMINIO JOAO CLEMENTE;R JOAQUIM NABUCO 2576;DIONISIO TORRES;60125121;FORTALEZA;CE;
00481201000158;OLIMPIA;R MARCOS MACEDO 1281;ALDEOTA;60150190;FORTALEZA;CE;
00486289000109;CONDOMINIO ED RHONNE;R BENTO ALBUQUERQUE 1633;COCO;60192055;FORTALEZA;CE;
00486314000146;EDIFICIO PORTINARI;R FRANCISCO FARIAS FILHO 120;PATRIOLINO RIBEIRO;60810110;FORTALEZA;CE;
00486317000180;CONDOMINIO ED SUSY;R TIRADENTES 555;RODOLFO TEOFILO;60430560;FORTALEZA;CE;
00488164000100;CONDOMINIO ED LA PLAZA;R DR RIBAMAR LOBO 532;COCO;60192230;FORTALEZA;CE;
00495538000114;CONDOMINIO DO ED ELDORADO;R LEONARDO MOTA 200;MEIRELES;60170040;FORTALEZA;CE;
00496704000105;CONDOMINIO PORTO SEGURO;AV ROGACIANO LEITE SN;SALINAS;60810786;FORTALEZA;CE;
00500718000147;EDIFICIO JOSE ROUX;R MNS OTAVIO DE CASTRO 21;FATIMA;60050150;FORTALEZA;CE;
00503871000128;CONDOMINIO ANDRE LINHARES;AV JOVITA FEITOSA 1081;AMADEU FURTADO;60455473;FORTALEZA;CE;
00503874000161;CONDOMINIO ED ANGELINA;AV ANTONIO JUSTA 2900;MEIRELES;60165090;FORTALEZA;CE;
00506631000187;CONDOMINIO ED MANAUARA;R RENATO BRAGA 200;VICENTE PINZON;60181481;FORTALEZA;CE;
00506632000121;CONDOMINIO ED VILLA FERRARA;R PAULO MORAIS 530;VARJOTA;60160330;FORTALEZA;CE;
00518604000124;CONDOMINIO KACTUS;R REPUBLICA DA ARMENIA 90;PRQ MANIBURA;60821760;FORTALEZA;CE;
00518642000187;CONDOMINIO ED LUCIA CORREIA;R JORGE SEVERIANO 75;VL UNIAO;60420180;FORTALEZA;CE;
00530838000197;CONDOMINIO ED JOSANETE;AV BR DE STUDART 3022;JOAQUIM TAVORA;60120002;FORTALEZA;CE;
00530841000100;CONDOMINIO ED GRAND PALAIS ANTONIO VIDAL;R DEP MOREIRA DA ROCHA 558;MEIRELES;60160060;FORTALEZA;CE;
00553897000180;SAVASSI VALENCIA;R MONSENHOR CATAO 1070;ALDEOTA;60175000;FORTALEZA;CE;
00555296000107;CONDOMINIO BONNEVILLE;AV DOS FRANCESES SN;EDSON QUEIROZ;60834285;FORTALEZA;CE;
00560907000105;CONDOMINIO RESIDENCIAL URUPES;AV CONTORNO NORTE 1800;CJ ESPERANCA;60763730;FORTALEZA;CE;
00568848000111;CONDOMINIO MOUNT PARADISE;TV CESAR MAGALHAES 655;CARLITO PAMPLONA;60311520;FORTALEZA;CE;
00570331000167;CONDOMINIO DR JOSE LINS CAVALCANTE;R SOUSA GIRAO 410;FATIMA;60055305;FORTALEZA;CE;
00573586000183;CONDOMINIO ED ROYAL;R PE ANTONINO 1017;JOAQUIM TAVORA;60110480;FORTALEZA;CE;
00577442000103;CONDOMINIO ED TERRACOTA;R PEREIRA VALENTE 501;MEIRELES;60160250;FORTALEZA;CE;
00577482000147;CONDOMINIO ED JAIBARAS;R PEREIRA VALENTE 220;MEIRELES;60160250;FORTALEZA;CE;
00592153000175;SHOPPING CENTER MAGAZIN LTDA;R FRANCISCO ALMEIDA 593;PRQ STA ROSA;60762845;FORTALEZA;CE;
00598163000118;CONDOMINIO TELEFONICO LISBOA;AV DA UNIVERSIDADE 3264;BENFICA;60020181;FORTALEZA;CE;
00608291000103;BARILOCHE;AV RUI BARBOSA 2435;JOAQUIM TAVORA;60115222;FORTALEZA;CE;
00608292000140;CONDOMINIO ED ATLANTIC VILLAGE;R JOAO NOGUEIRA BORGES 120;PR DO FUTURO;60180000;FORTALEZA;CE;
00613484000144;CONDOMINIO ED SUELY CARDOSO LINHARES;R BR DE ARACATI 2755;JOAQUIM TAVORA;60115082;FORTALEZA;CE;
00613487000188;CONDOMINIO DO ED ATLANTIC CENTER;R SILVA JATAHY 15;MEIRELES;60165070;FORTALEZA;CE;
00614887000108;SANTOS DUMONT CENTER;AV SANTOS DUMONT 1687;ALDEOTA;60150161;FORTALEZA;CE;
00620912000166;CONDOMINIO DO ED 150 OFFICERS;AV SEN VIRGILIO TAVORA 150;MEIRELES;60170250;FORTALEZA;CE;
00621891000101;CONDOMINIO ED GISELLE;R RAMOS BOTELHO 1382;PAPICU;60175265;FORTALEZA;CE;
00626773000188;CONDOMINIO DO ED VANCOUVER;R TIBURCIO CAVALCANTE 2100 HULL;DIONISIO TORRES;60125101;FORTALEZA;CE;
00628817000109;CONDOMINIO ED TAMBAQUI;R PINTO MADEIRA 757;CENTRO;60150000;FORTALEZA;CE;
00631707000104;CONDOMINIO TELEFONICO TELEMINIO CASTELAO II;R PROFA STELLA COCHRANE 155 ADMINISTRACAO;ITAPERI;60743670;FORTALEZA;CE;
00631709000195;CONDOMINIO TELEFONICO TELEMINIO RESIDENCIAL ALDEBARAN;AV FRANCISCO SA 3636 ADMINISTRACAO;JACARECANGA;60310003;FORTALEZA;CE;
00631711000164;CONDOMINIO JOAO DA SILVA ANTUNES;R DOIS 80;PRES KENNEDY;60355634;FORTALEZA;CE;
00634431000100;CONDOMINIO DO CONJUNTO RESIDENCIAL MARQUES DE SAPUCAI;R BULGARIA 970;MANUEL SATIRO;60713500;FORTALEZA;CE;
00639323000120;CONDOMINIO DO SHOPPING PAULO DE MATTOS PINTO;AV MNS TABOSA 242;CENTRO;60165010;FORTALEZA;CE;
00640859000165;HOLANDA RESIDENSE;R AFONSO CELSO 1120;ALDEOTA;60140190;FORTALEZA;CE;
00647373000159;CONDOMINIO DO ED MAGNA PONTES VIEIRA;R ARAKEN SILVA 81;DIONISIO TORRES;60170190;FORTALEZA;CE;
00655254000148;CONDOMINIO ED AMOARAS;R SILVA JATAHY 355;MEIRELES;60165070;FORTALEZA;CE;
00661466000138;CONDOMINIO LADY;AV HUMBERTO MONTE 2450;PARQUELANDIA;60455372;FORTALEZA;CE;
00661467000182;CONDOMINIO ED HYDE PARK;R D EXPEDITO LOPES 2577;DIONISIO TORRES;60135410;FORTALEZA;CE;
00666457000130;CONDOMINIO ED ROGER;R REPUBLICA DO LIBANO 899;MEIRELES;60160140;FORTALEZA;CE;
00668560000119;EDIFICIO VILLAGE CASTEL DE VENEZA;R TEN BENEVOLO 2211;MEIRELES;60160041;FORTALEZA;CE;
00671752000184;CONDOMINIO ED ODONTOLOGIA ESPECIALIZADA;AV DES MOREIRA 2808;DIONISIO TORRES;60170172;FORTALEZA;CE;
00675570000181;CONDOMINIO DO ED DUBLIM;R CEL ALVES TEIXEIRA 1480;DIONISIO TORRES;60135208;FORTALEZA;CE;
00675779000145;CONDOMINIO ED IMPERIUM;R OSVALDO CRUZ 2310;DIONISIO TORRES;60125151;FORTALEZA;CE;
00687456000171;MONTREAL;R DES LEITE ALBUQUERQUE 150;ALDEOTA;60150150;FORTALEZA;CE;
00687458000160;PLAZA TOWER;AV SANTOS DUMONT 2626 ADMINISTRACAO;ALDEOTA;60150162;FORTALEZA;CE;ANDREA@AUTHORITY.COM.BR
00698880000111;CONDOMINIO ED SANAMAYKA;R ISRAEL BEZERRA 1010;S JOAO DO TAUAPE;60135472;FORTALEZA;CE;
00700786000150;CONDOMINIO EDIFIVIO PARATI;R PEREIRA VALENTE 610;MEIRELES;60160250;FORTALEZA;CE;
00720335000184;EDIFICIO SHOPPING SOLARIS;AV PROF GOMES DE MATOS 648;BOM FUTURO;60416392;FORTALEZA;CE;
00724276000112;EDIFICIO REIS MAGOS;R THOMAZ POMPEU 345;MEIRELES;60160080;FORTALEZA;CE;
00727943000110;CONDOMINIO FORTALEZA MART CENTER;AV LUCIANO CARNEIRO 1333 ADMINISTRACAO;PARREAO;60410321;FORTALEZA;CE;
00728036000196;CONDOMINIO ED FRANCISCA LEONIDAS;R BENTO ALBUQUERQUE 447;COCO;60192060;FORTALEZA;CE;
00729063000183;CONDOMINIO DO ED CEL BENTO LEITE;R LAURO MAIA 291;JOSE BONIFACIO;60055210;FORTALEZA;CE;
00737377000128;CONDOMINIO ED ALBATROZ;R MNS CATAO 1766;DIONISIO TORRES;60170198;FORTALEZA;CE;
00750669000109;CONDOMINIO ED HOT CENTER;AV JULIO ABREU 160;VARJOTA;60160240;FORTALEZA;CE;
00756459000110;CONDOMINIO ED PORTAL D ORLEANS;R REPUBLICA DO LIBANO 975;MEIRELES;60160140;FORTALEZA;CE;
00758729000121;CONDOMINIO ED CANAA;R OTAVIO FERREIRA MACHADO 51;PAPICU;60176020;FORTALEZA;CE;
00761447000183;CONDOMINIO ED LITANE;R REPUBLICA DO LIBANO 870;MEIRELES;60160140;FORTALEZA;CE;
00761448000128;CONDOMINIO TELEFONICO TELEMINIO PARQUE MESSEJANA;R PE PEDRO DE ALENCAR 1620 ADMINISTRACAO;PRQ STA MARIA;60873082;FORTALEZA;CE;
00761451000141;CONDOMINIO ED MANSAO BARCELONA;R PROF HERACLITO 313;VICENTE PINZON;60181245;FORTALEZA;CE;
00764056000112;CONDOMINIO ED PORTAL D ORLEANS;R REPUBLICA DO LIBANO 975;MEIRELES;60160140;FORTALEZA;CE;
00765127000100;CONDOMINIO ED COML J I;R NUNES VALENTE 2210;DIONISIO TORRES;60125071;FORTALEZA;CE;
00765130000115;CONDOMINIO RESIDENCIAL IRECE;V COLETORA SUL 255;NOVO MONDUBIM;60763828;FORTALEZA;CE;
00765200000135;CONDOMINIO DO ED TERESINHA DE JESUS MARTINS;AV MR HULL 3522;PRES KENNEDY;60356000;FORTALEZA;CE;
00771495000152;CONDOMINIO ED ITAJAI;R FR MANSUETO 1290;MEIRELES;60175070;FORTALEZA;CE;
00771528000164;CONDOMINIO EDFICIO CANAA;R OTAVIO FERREIRA MACHADO 51;PAPICU;60176020;FORTALEZA;CE;
00777453000129;CONDOMINIO FR MARCELINO;R TIRADENTES 700;RODOLFO TEOFILO;60430560;FORTALEZA;CE;
00784930000183;CONDOMINIO DO ED MIRAFIORI;R TAVARES COUTINHO 1736;VARJOTA;60160130;FORTALEZA;CE;
00785145000145;CONDOMINIO ED MACEIO;R CANUTO DE AGUIAR 1290;MEIRELES;60160120;FORTALEZA;CE;
00786331000107;CONDOMINIO ED PAQUETA;R PROF DIAS DA ROCHA 2240;DIONISIO TORRES;60170311;FORTALEZA;CE;
00786341000134;CONDOMINIO LA DEFENSE;AV BR DE STUDART 200;MEIRELES;60120000;FORTALEZA;CE;
00790916000192;CONDOMINIO VERMONT;R ALFEU ABOIM 500;PAPICU;60175375;FORTALEZA;CE;
00798184000187;CONDOMINIO ED LAGUNA;R OITO DE SETEMBRO 1130;VARJOTA;60175210;FORTALEZA;CE;
00805391000111;RESIDENCIAL ALDEBARAN;AV FRANCISCO SA 3636;CARLITO PAMPLONA;60310052;FORTALEZA;CE;
00808685000105;CONDOMINIO DO ED ANDREA;R TIBURCIO CAVALCANTE 2405;DIONISIO TORRES;60125101;FORTALEZA;CE;
00808689000185;CONDOMINIO ED SAFIRA;R JULIO AZEVEDO 505;PAPICU;60175782;FORTALEZA;CE;
00825148000165;RESIDENCIAL BARILOCHE;AV DEP PAULINO ROCHA 46;CAJAZEIRAS;60864310;FORTALEZA;CE;
00825150000134;CONDOMINIO AUGUSTE RODIN;R MANOEL CRUZ SN;PATRIOLINO RIBEIRO;60810225;FORTALEZA;CE;
00835584000115;CONDOMINIO ED SANTA ISABEL;R PROF ANACLETO 42;PARQUELANDIA;60450360;FORTALEZA;CE;
00835821000148;CONDOMINIO DO BLOCO F DO CONJUNTO RESIDENCIAL UIRAPURU;AV GODOFREDO MACIEL 2543 AP 205;JD CEARENSE;60712023;FORTALEZA;CE;
00835823000137;CONDOMINIO ED BUCKINGHAM;R FRANCISCO FARIAS FILHO SN;PATRIOLINO RIBEIRO;60810110;FORTALEZA;CE;
00835826000170;EDIFICIO VILLAGE REPUBLICA DO LIBANO;R REPUBLICA DO LIBANO 20;MEIRELES;60160140;FORTALEZA;CE;
00841923000176;CONDOMINIO ED MORANDA;R TERTULIANO SALES 505;S JOAO DO TAUAPE;60410790;FORTALEZA;CE;
00842333000168;EDIFICIO CDM DR FONTENELE;R SILVA PAULET 701;MEIRELES;60120020;FORTALEZA;CE;
00862014000114;CONDOMINIO TELEFONICO TELEMINIO MONTE REI;R ALFREDO MAMEDE 777 ADMINISTRACAO;VL MANOEL SATIRO;60763800;FORTALEZA;CE;
00862016000103;CONDOMINIO TELEFONICO TELEMINIO BARILOCHE;AV DEP PAULINO ROCHA 46 ADMINISTRACAO;CAJAZEIRAS;60864310;FORTALEZA;CE;
00862017000158;CONDOMINIO TELEFONICO TELEMINIO URUPES;AV CONTORNO NORTE 1800 ADMINISTRACAO;CJ ESPERANCA;60763730;FORTALEZA;CE;
00862019000147;CONDOMINIO TELEFONICO TELEMINIO MARCOS FREIRE;TV COSTA E SILVA 422 ADMINISTRACAO;MONDUBIM;60762265;FORTALEZA;CE;
00862022000160;CONDOMINIO KELLY CRISTINE;AV RUI BARBOSA 2480;JOAQUIM TAVORA;60115222;FORTALEZA;CE;
00862546000151;CONDOMINIO RESIDENCIAL SAGARANA;AV CONTORNO NORTE 355;CJ ESPERANCA;60763730;FORTALEZA;CE;
00864288000142;CONDOMINIO RESIDENCIAL VOLPI PANCETTI;R MANUEL JESUINO 945;VARJOTA;60175214;FORTALEZA;CE;
00869491000101;CONDOMINIO ED SOLAR VOLPI PANCETTI;R MANUEL JESUINO 945;VARJOTA;60175214;FORTALEZA;CE;
00869943000155;ST THOMAS OPEN MALL;AV PE ANTONIO TOMAS 850;ALDEOTA;60140160;FORTALEZA;CE;
