09334424000167;EDIFICIO URANO;R ANA BILHAR 941;MEIRELES;60160110;FORTALEZA;CE;
09338363000106;RESIDENCIAL JABORANDI;R JABORANDI 825;JANGURUSSU;60865270;FORTALEZA;CE;
09343524000150;CONDOMINIO ED PALAZZO POSITANO;R BR DE ARATANHA 1020;JOSE BONIFACIO;60050071;FORTALEZA;CE;
09344544000145;CONDOMINIO RESIDENCIAL VINHAS DA LAGOA;AV PROF JOSE ARTHUR DE CARVALHO 2817;LGA REDONDA;60831370;FORTALEZA;CE;
09348739000163;RESIDENCIAL JOAO MARCELO;R SEM DENOMINACAO OFICIAL 155;JOQUEI CLUBE;60510107;FORTALEZA;CE;
09348801000117;RESIDENCIAL MARIA LETICIA;R SEM DENOMINACAO OFICIAL 55;JOQUEI CLUBE;60510107;FORTALEZA;CE;
09348818000174;RESIDENCIAL MAGNOLIA;AV BENJAMIM BRASIL 1100;MONDUBIM;60711442;FORTALEZA;CE;
09357134000139;RESIDENCIAL BUZIOS;R DOIS 99;ITAPERI;60743220;FORTALEZA;CE;
09359899000108;CONDOMINIO DO ED BOULEVARD SILVANA;R NUNES VALENTE 1560;ALDEOTA;60125035;FORTALEZA;CE;
09363000000120;CONDOMINIO SHOPPING PATIO AGUA FRIA;AV WASHINGTON SOARES 3690;PRQ MANIBURA;60821750;FORTALEZA;CE;
09364939000100;CONDOMINIO ALTO DO MOSTEIRO;R CEL LUIS FIDELIS 1700;S BENTO;60875670;FORTALEZA;CE;
09365709000165;EDIFICIO AVILA;AV ROGACIANO LEITE 1060;SALINAS;60810786;FORTALEZA;CE;
09365886000141;CONDOMINIO SAN DIEGO RESIDENCE;AV EVILASIO ALMEIDA MIRANDA 1881;SAPIRANGA;60833302;FORTALEZA;CE;
09369206000168;RESIDENCIAL MIGUEL MACHADO;R CON MOURAO 200;PARANGABA;60710080;FORTALEZA;CE;
09375355000130;EDIFICIO JARDINS DE LISIEUX;R D SEBASTIAO LEME 985;FATIMA;60050160;FORTALEZA;CE;
09376059000153;RESIDENCIAL BENTO GONALVES;R BENTO GURGEL 700;MONDUBIM;60767265;FORTALEZA;CE;
09383839000120;CONDOMINIO OLIVER PARK;R JOAOZITO ARRUDA 2250;PRQ IRACEMA;60824075;FORTALEZA;CE;
09383866000101;CONDOMINIO VILLA BELLAGIO;R DAS AROEIRAS 94;PASSARE;60743820;FORTALEZA;CE;
09384622000135;CONDOMINIO COM DE DISTRIBUICAO DE MOVEIS LTDA ME;AV JOAO PESSOA 4782;DAMAS;60425812;FORTALEZA;CE;
09384713000170;CONDOMINIO ED PIETRA LAZULI;R MIN JOAQUIM BASTOS 471;FATIMA;60415040;FORTALEZA;CE;
09387579000161;CONDOMINIO ED LE CASTEL;R ANDRADE FURTADO 970;COCO;60192072;FORTALEZA;CE;
09387640000170;CONDOMINIO VITORIA;RUA MARIO ALENCAR ARARIPE 73 ;EDSON QUEIROZ;60834001;FORTALEZA;CE;
09393456000133;CONDOMINIO ED PEDRO RAMALHO;R ROCHA LIMA 1425;ALDEOTA;60135285;FORTALEZA;CE;
09394920000106;CONDOMINIO MAISON LA FRANCE;R MILIA VERAS 100;CIDADE DOS FUNCIONARIOS;60822585;FORTALEZA;CE;
09410378000138;CONDOMINIO RESIDENCIAL BRASILIA;VL GOIAS 1029;PAN AMERICANO;60441002;FORTALEZA;CE;
09411126000123;CONDOMINIO RESIDENCIAL CORACAO DE JESUS;R D HELIO CAMPOS 493;CARLITO PAMPLONA;60311630;FORTALEZA;CE;
09415978000199;SOLARIUM RESIDENCE;R DR MANUEL MOREIRA 255;MONDUBIM;60762418;FORTALEZA;CE;
09443609000100;RESIDENCIAL BARRA SOL POENTE;R IRAPUA 398;BARRA DO CEARA;60331300;FORTALEZA;CE;
09452831000179;CONDOMINIO ATLANTIS II;R DR JOSE LOURENCO 3308;JOAQUIM TAVORA;60115282;FORTALEZA;CE;
09452839000135;CONDOMINIO ED LAREDO;AV RUI BARBOSA 2665;JOAQUIM TAVORA;60115222;FORTALEZA;CE;
09467356000104;CONDOMINIO THAIS ARRUDA BRAGA;R ABELARDO MARINHO 332;VL UNIAO;60411075;FORTALEZA;CE;
09470878000165;EDIFICIO MEIRELES RESIDENCE;R OSVALDO CRUZ 188;MEIRELES;60125150;FORTALEZA;CE;
09480135000176;CONDOMINIO LES VILLAS;AV POMPILIO GOMES 312;PASSARE;60861790;FORTALEZA;CE;
09484658000190;CONDOMINIO ED SOPHIA MARINHO;R THOMAZ POMPEU 261;MEIRELES;60160080;FORTALEZA;CE;
09491073000106;CONDOMINIO ILHAS OCEANICAS;R DALVA RODRIGUES 150;DE LOURDES;60177335;FORTALEZA;CE;
09500730000126;CONDOMINIO ED EAST SIDE;R DR GILBERTO STUDART 770;COCO;60192105;FORTALEZA;CE;
09501697000159;CONDOMINIO RESERVA DO PARQUE B;AV PE ANTONIO TOMAS 3855;COCO;60192120;FORTALEZA;CE;
09525132000101;CONDOMINIO ALPHA VILLAGE;R CEL ALUISIO BORBA 204;ENG LUCIANO CAVALCANTE;60813730;FORTALEZA;CE;
09541290000155;CONDOMINIO VILLAGE COSTA MARINA;AV DAS ADENANTERAS 600;CIDADE 2000;60190560;FORTALEZA;CE;
09569288000194;VILLA BELLA RESIDENCE;AV BENJAMIM BRASIL 1600;MONDUBIM;60711442;FORTALEZA;CE;
09578992000103;CONDOMINIO RESIDENCIAL CARMEL IMPERIAL;R PROF SOLON FARIAS 2000;JOSE DE ALENCAR;60830045;FORTALEZA;CE;
09581852000194;MARYSE RESIDENCE;R MAL DEODORO 460;BENFICA;60020060;FORTALEZA;CE;
09583256000143;EDIFICIO BRISA DO LESTE;R PEREIRA DE MIRANDA 1620;PAPICU;60175045;FORTALEZA;CE;
09583412000176;CONDOMINIO RESIDENCIAL SOBERANO II;R HERACLITO DOMINGUES 1096;S GERARDO;60320200;FORTALEZA;CE;
09589818000166;CONDOMINIO ED PARADIZE;R JACINTO BOTELHO 222;PRQ DOIS IRMAOS;60743268;FORTALEZA;CE;
09590245000190;CONDOMINIO ED BELIZE;R JOSE ALVES CAMPOS 169;PATRIOLINO RIBEIRO;60810040;FORTALEZA;CE;
09591237000169;EDIFICIO VARANDAS DE IRAPUA;R CEL LINHARES 1111;ALDEOTA;60170075;FORTALEZA;CE;
09591246000150;CONDOMINIO ENSEADA DO MUCURIPE;AV DA ABOLICAO 4043;MUCURIPE;60165085;FORTALEZA;CE;
09597123000126;CONDOMNIO RESIDENCIAL PARQUE ADRIANO;AV JUSCELINO KUBITSCHEK 3700;PASSARE;60861630;FORTALEZA;CE;
09619322000198;CONDOMIINIO MANSAO CERVANTES;R TOMAS RODRIGUES SN;ALDEOTA;60175080;FORTALEZA;CE;
09621182000192;RESIDENCIAL BROMELIAS;R DAS CARNAUBAS 560;PASSARE;60743780;FORTALEZA;CE;
09650163000194;CONDOMINIO ED TERRACOS DO ATLANTICO;AV HISTO RAIMUNDO GIRAO 860;MEIRELES;60165050;FORTALEZA;CE;
09656953000187;RESIDENCIAL GENESIS;R TRAJANO DE MORAIS 333;PASSARE;60861710;FORTALEZA;CE;
09660552000109;ANTONIO MESQUITA;R ALVARO MARTINS 116;DAMAS;60425785;FORTALEZA;CE;
10140983000115;CONDOMINIO PARQUE PAMPULHA RESIDENCE;R CONDADO 405;MESSEJANA;60842180;FORTALEZA;CE;
10212338000160;CONDOMINIO RESIDENCIAL MAFRA;R AFONSO PENA 520;SAPIRANGA;60833355;FORTALEZA;CE;
10220106000154;CONDOMINIO ENSEADA RESIDENCE;R ANTONIO GENTIL 1515;SAPIRANGA;60833695;FORTALEZA;CE;
10228323000190;CONDOMINIO PORTO SEGURO;R FRANCISCO AVELINO 285;LGA REDONDA;60831510;FORTALEZA;CE;
10242385000157;MONTERREY RESIDENCE;R NOGUEIRA ACIOLI 1030;CENTRO;60110140;FORTALEZA;CE;
10248226000160;CONDOMINIO NAPOLI CITY I;R PROF SOLON FARIAS 50;EDSON QUEIROZ;60834375;FORTALEZA;CE;
10253678000130;CONDOMINIO BRISAS DO PASSARE;AV PALESTINA 994;PASSARE;60744000;FORTALEZA;CE;
10260454000155;CONDOMINIO RESIDENCIAL QUARTZO;AV I 855;PREF JOSE WALTER;60750080;FORTALEZA;CE;
10276183000126;RESIDENCIAL PERIGUARI;R DR PERIGUARI 161;ANTONIO BEZERRA;60360600;FORTALEZA;CE;
10278215000122;CONDOMINIO ED VILA FIORI;R ALBERTO FEITOSA LIMA 100;PATRIOLINO RIBEIRO;60810018;FORTALEZA;CE;
10288324000120;CONDOMINIO RESIDENCIAL ARACATI;R BR DE ARACATI 1112;ALDEOTA;60115081;FORTALEZA;CE;
10291126000116;CONDOMINIO RESIDENCIAL JASMIN;R LUCIANO ALVES 3199;JANGURUSSU;60870640;FORTALEZA;CE;
10296673000194;EDIFICIO FR DAMIAO;TV SRG HERMINIO 744;MTE CASTELO;60350550;FORTALEZA;CE;
10308502000138;CONDOMINIO ED LES JARDINS;R JOSE VILAR 2963;DIONISIO TORRES;60125001;FORTALEZA;CE;
10313274000194;CONDOMINIO ALIPIO BASTOS;R PROF JOSE HENRIQUE 1437;GUAJIRU;60843270;FORTALEZA;CE;
10316035000198;CONDOMINIO ED SOLON PINHEIRO;R SOLON PINHEIRO 1261;JOSE BONIFACIO;60050041;FORTALEZA;CE;
10320945000144;CONDOMINIO RECIDENCIAL PORTO RICO VILAGE;R NAPOLEAO QUEZADO 730;PARANGABA;60710010;FORTALEZA;CE;
10330347000156;CONDOMINIO ED DIAMANTINA;R MNS FURTADO 1784;RODOLFO TEOFILO;60430355;FORTALEZA;CE;
10335204000137;CONDOMINIO RESIDENCIAL OPALA;AV I 901;PREF JOSE WALTER;60750080;FORTALEZA;CE;
10335240000109;CONDOMINIO RESIDENCIAL AMETISTA;AV I 945;PREF JOSE WALTER;60750080;FORTALEZA;CE;
10335319000121;CONDOMINIO RESIDENCIAL DIONISIO CERQUEIRA;R CENTO E UM SDO 1311;MONDUBIM;60000000;FORTALEZA;CE;
10335929000125;CONDOMINIO RESIDENCIAL VILLA AMALFI;R CEL MANUEL ALBANO 549;MONDUBIM;60711465;FORTALEZA;CE;
10344308000108;CONDOMINIO FR DAMIAO III;R OSCAR PEDREIRA 125;JACARECANGA;60010670;FORTALEZA;CE;
10344321000167;EDIFICIO ATLANTIC OCEAN RESIDENCE;AV HISTO RAIMUNDO GIRAO 580;MEIRELES;60165050;FORTALEZA;CE;
10347630000190;CONDOMINIO RESIDENCIAL ITAMBE;R BRUMANA 45;LGA REDONDA;60831470;FORTALEZA;CE;
10362441000197;CONDOMINIO ED ALLAMBRA;R VILEBALDO AGUIAR 1548;COCO;60192025;FORTALEZA;CE;
10362968000111;EDIFICIO PREMIUM;R DR GILBERTO STUDART 1168;COCO;60192095;FORTALEZA;CE;
10369214000193;CONDOMINIO DO ED VIVALDI;R CEL JUCA 960;ALDEOTA;60170288;FORTALEZA;CE;
10380756000167;CONDOMINIO ED JOINVILLE;AV ENG ALBERTO SA 100;PAPICU;60175395;FORTALEZA;CE;
10380780000104;CONDOMINIO ED EBANO CENTRO EMPRESARIAL;R COSTA BARROS 915;CENTRO;60160280;FORTALEZA;CE;
10380798000106;CONDOMINIO ED CEMOARA;AV RUI BARBOSA SN ESQ C DEP M ROCHA;ALDEOTA;60115221;FORTALEZA;CE;
10380814000152;CONDOMINIO ED TRANSATLANTICO;R PTO ANTONIO BANDEIRA 1750;VICENTE PINZON;60182292;FORTALEZA;CE;
10380947000129;CONDOMINIO DO ED CLARISSE;R LEONARDO MOTA 1583;ALDEOTA;60170041;FORTALEZA;CE;
10380962000177;CONDOMINIO ED REIS;R BENTO ALBUQUERQUE 530;COCO;60192060;FORTALEZA;CE;
10381028000170;CONDOMINIO ED PRELUDIO;R ANA BILHAR 150;MEIRELES;60160110;FORTALEZA;CE;
10381051000164;CONDOMINIO ED PRES KENNEDY;AV BEIRA MAR 1750;MEIRELES;60165120;FORTALEZA;CE;
10388752000125;CONDOMINIO ED DELLA ROSA;R MAJ PEDRO SAMPAIO 1166;RODOLFO TEOFILO;60430185;FORTALEZA;CE;
10393346000150;CONDOMINIO DO ED JARDIM ITAPOA;R FR MANSUETO 115;MUCURIPE;60175185;FORTALEZA;CE;
10393387000147;CONDOMINIO DO ED FORTALEZA;AV DQ DE CAXIAS 440;CENTRO;60035110;FORTALEZA;CE;
10393429000140;CONDOMINIO DO ED NEUVEVILLE;R G 75;MANOEL DIAS BRANCO;60191070;FORTALEZA;CE;
10393445000132;CONDOMINIO DO ED QUEENS;R BARBALHA 100;MEIRELES;60165100;FORTALEZA;CE;
10393494000175;CONDOMINIO ED TAHITI;R VILEBALDO AGUIAR 607;COCO;60192010;FORTALEZA;CE;
10393528000121;CONDOMINIO RESIDENCIAL DARCAR;R PEDRO MACHADO 921;DAMAS;60426086;FORTALEZA;CE;
10393601000165;CONDOMINIO DO ED RESIDENCIAL DUQUE DE CAXIAS;AV DQ DE CAXIAS 2136;JACARECANGA;60035078;FORTALEZA;CE;
10393650000106;CONDOMINIO DO ED VICTOR II;R OSVALDO CRUZ 505;MEIRELES;60125150;FORTALEZA;CE;
10393676000146;CONDOMINIO ED DR WILSON PINHEIRO;R PROF RAIMUNDO VITOR 60;PARQUELANDIA;60450115;FORTALEZA;CE;
10393684000192;CONDOMINIO ED DANIELLE RANGEL;AV ANTONIO SALES 2255;DIONISIO TORRES;60135203;FORTALEZA;CE;
10393718000149;GERSON ALVES;R TAVARES COUTINHO 540;VARJOTA;60160130;FORTALEZA;CE;
10394564000100;RESIDENCIAL MORADA DO SOL;AV ODILON GUIMARAES 4583;LGA REDONDA;60831295;FORTALEZA;CE;
10413757000160;CONDOMINIO RESIDENCIAL RIVIERA DI CAPRI;R FRANCISCO LEANDRO 272;CURIO;60844150;FORTALEZA;CE;
10419475000170;SHOPPING IMPERIAL OPEN MALL;AV WASHINGTON SOARES 3777;SAPIRANGA;60833005;FORTALEZA;CE;
10429197000132;CONDOMINIO ESFERA I;R TOMAS RODRIGUES 1361;ANTONIO BEZERRA;60361000;FORTALEZA;CE;
10435821000104;CONDOMINIO ED RESIDENCIAL NORTH VILLAGE;R MARGARIDA MARIA 1000;PRES KENNEDY;60355501;FORTALEZA;CE;
10438112000182;CONDOMINIO PORTAL DO CANADA II;R MARIO MAMEDE 555;FATIMA;60415000;FORTALEZA;CE;
10445866000160;RSP REDE SHOPPING CENTER POPULAR LTDA ME;TV PARA 12 SL 804 A;CENTRO;60025120;FORTALEZA;CE;
10449322000176;CONDOMINIO ED ANAPOLIS;R CRISPIM ALMEIDA 55;MTE CASTELO;60325800;FORTALEZA;CE;
10449583000196;EDIFICIO COSTAMARE;R MANUEL JACARE 136;MUCURIPE;60175110;FORTALEZA;CE;
10457971000119;CONDOMINIO TERRA DI FIORI;AV PALESTINA 400;PASSARE;60744000;FORTALEZA;CE;
10461227000198;CENTRO COML FLAVIO CARNEIRO;AV SANTOS DUMONT 2849;ALDEOTA;60150165;FORTALEZA;CE;
10461788000197;CONDOMINIO VOLTA DA JUREMA;AV BEIRA MAR 3400;MEIRELES;60165120;FORTALEZA;CE;
10461925000193;CONDOMINIO ED RENAISSANCE;R TIBURCIO CAVALCANTE 398;MEIRELES;60125100;FORTALEZA;CE;
10462588000159;CONDOMINIO DO ED RENNES;R MARIA TOMASIA 1390;ALDEOTA;60150170;FORTALEZA;CE;
10462612000150;CONDOMINIO ED MONTETHABOR;R ANDRADE FURTADO 1245;COCO;60192072;FORTALEZA;CE;
10462620000104;CONDOMINIO LILIAN LEYNE;R JOAO CARVALHO 67;ALDEOTA;60140140;FORTALEZA;CE;
10468134000195;CONDOMINIO ED ICONE;R BENTO ALBUQUERQUE 360;COCO;60192060;FORTALEZA;CE;
10482486000103;EDIFICIO TOUR VILLE RESIDENCE;R DR JOSE LOURENCO 555;MEIRELES;60115280;FORTALEZA;CE;
10487734000109;CONDOMINIO ED PORTO BELO;R CNSO TRISTAO 1500;FATIMA;60050165;FORTALEZA;CE;
10487841000129;PIATAN;R DR JOSE LINO 646;VARJOTA;60175426;FORTALEZA;CE;
10487932000164;CONDOMINIO ED LEONARDO A JORDAO;R REPUBLICA DA ARMENIA 110;PRQ MANIBURA;60821760;FORTALEZA;CE;
10489925000100;CONDOMINIO ED ATHENAS;R GEN TERTULIANO POTIGUARA 1313;ALDEOTA;60135280;FORTALEZA;CE;
10489987000103;CONDOMINIO ED PAULO ROBERTO;R PINHO PESSOA 406;JOAQUIM TAVORA;60135170;FORTALEZA;CE;
10490076000104;CONDOMINIO DO ED JARDIM IMPERIAL;R BR DO RIO BRANCO 3130;FATIMA;60025062;FORTALEZA;CE;
10490266000113;CONDOMINIO ARABELA;R FRANCISCO XEREZ 80;PATRIOLINO RIBEIRO;60810035;FORTALEZA;CE;
10490340000100;CONDOMINIO J M MESQUITA BLOCO B;R JOAO CORDEIRO 374;PR DE IRACEMA;60060292;FORTALEZA;CE;
10490372000105;CONDOMINIO DO ED VITOR VEIGA;R JOAQUIM NABUCO 2769;DIONISIO TORRES;60125121;FORTALEZA;CE;
10490415000144;CONDOMINIO ED PARQUEVILLE;R GUSTAVO SAMPAIO 1029;PARQUELANDIA;60455001;FORTALEZA;CE;
10490431000137;CONDOMINIO DO ED SALES;R FRANCISCO TEIXEIRA DE ALCANTARA 55 COND DO ED SALES;ANTONIO DIOGO;60182360;FORTALEZA;CE;
10490480000170;CONDOMINIO MORADA VILA GOES;AV BEZERRA DE MENEZES 2690;S GERARDO;60325002;FORTALEZA;CE;
10490654000102;CONDOMINIO ED GUILHERMINA REIS;VL ILDEFONSO ALBANO 2395;JOAQUIM TAVORA;60115070;FORTALEZA;CE;
10490738000138;CONDOMINIO ED JOSE BONIFACIO;R ASSUNCAO 757;JD CEARENSE;60712020;FORTALEZA;CE;
10490746000184;CONDOMINIO DO ED MORADA DOS MARECHAIS;R MAL DEODORO 1301;BENFICA;60020061;FORTALEZA;CE;
10490803000125;CONDOMINIO ED GUILHERME ROCHA;R GUILHERME ROCHA 1476;CENTRO;60030141;FORTALEZA;CE;
10490969000141;CONDOMINIO DO ED LUCIANO CARNEIRO;AV LUCIANO CARNEIRO 1860;VL UNIAO;60410692;FORTALEZA;CE;
10491025000199;CONDOMINIO DO ED HUMBERTO ALBANO TEOFILO;TV ESTADOS UNIDOS 665;MEIRELES;60170270;FORTALEZA;CE;
10493130000167;CONDOMINIO RESIDENCIAL VIVENDAS DE IRACEMA;R DOMINGOS RAYOL 490;MESSEJANA;60841465;FORTALEZA;CE;
10493944000100;RESIDENCIAL IMPERIAL CONDOMINIUM;R JOSE VILAR DE ANDRADE 2005;SAPIRANGA;60833096;FORTALEZA;CE;
10495991000184;GRAND MONDE CLUB RESIDENCE;R VILEBALDO AGUIAR 1311;PAPICU;60190780;FORTALEZA;CE;
10497032000106;CONDOMINIO ED ALFA;R BARBARA DE ALENCAR 397;CENTRO;60140000;FORTALEZA;CE;
10497271000158;CONDOMINIO PORTAL DE LEON;R UM SN LT CIDADE SUL PRQ DEL S;SERRINHA;60742764;FORTALEZA;CE;
10497277000125;CONDOMINIO MONTSERRAT RESIDENCE;R BRUNO PORTO SN LT CIDADE SUL PRQ DE;PRQ IRACEMA;60824010;FORTALEZA;CE;
10497300000181;CONDOMINIO PORTAL DE MADRID;R DOIS SN LT CIDADE SUL PRQ DE;SERRINHA;60742766;FORTALEZA;CE;
10499896000159;CONDOMINIO RESIDENCIAL SANTA HELENA;R CARNEIRO DA CUNHA 300;JACARECANGA;60010470;FORTALEZA;CE;
10505478000127;CONDOMINIO TORONTO;R MARCELINO LOPES 4150;SAPIRANGA;60833075;FORTALEZA;CE;
10511250000140;EDIFICIO RESIDENCIAL CABRAL VERAS;R PROF MANDUCA 553;MONDUBIM;60711555;FORTALEZA;CE;
10516460000120;CONDOMINIO NEVINHA MENDES COML;AV AGUANAMBI 790 SL 1;FATIMA;60055403;FORTALEZA;CE;
10530648000123;CONDOMINIO CERVANTES RESIDENCE ED LA GALATEA;R TRES LOTEAMENTO CIDADE SUL 101;CIDADE DOS FUNCIONARIOS;60000000;FORTALEZA;CE;
10533476000141;CONDOMINIO FENIX;R FENIX 830;SALINAS;60811000;FORTALEZA;CE;
10533608000135;CONDOMINIO SONHO DE ICARO;AV VIENA WEYNE 1180;CAMBEBA;60822180;FORTALEZA;CE;
10535642000149;CONDOMINIO ED MIRANTE DO PARQUE;R ANDRADE FURTADO 145;COCO;60192070;FORTALEZA;CE;
10540207000102;RESIDENCIAL CASTRO MEIRELES;R CASTRO MEIRELES 399;MONDUBIM;60711475;FORTALEZA;CE;
10552309000148;CONDOMINIO RESIDENCIAL ED PALAZZO FLORENSE;R LIDIA BRIGIDO 500;PRQ MANIBURA;60821800;FORTALEZA;CE;
10567007000143;FLORIPA;R PEREIRA VALENTE 1556;VARJOTA;60175218;FORTALEZA;CE;
10592941000115;EDIFICIO STAR PLACE I;R EDUARDO SABOIA 600;PAPICU;60175145;FORTALEZA;CE;
10594925000161;CONDOMINIO RESIDENCIAL AUSTRALES;TV ADEMAR DE CASTRO 53;PRQ IRACEMA;60824038;FORTALEZA;CE;
10596780000138;RESIDENCIAL LUIZA PONCIANO;R MENDES GUIMARAES 451;PRES KENNEDY;60355481;FORTALEZA;CE;
10621040000104;RENATA ROCHA;R VINTE E SETE 190;VL VELHA;60347680;FORTALEZA;CE;
10622195000165;CONDOMINIO SEVILLA;R AFONSO PENA 155;EDSON QUEIROZ;60834522;FORTALEZA;CE;
10624320000176;EDIFICIO DANIELA;R BENTO ALBUQUERQUE 1717;COCO;60192055;FORTALEZA;CE;
10624805000160;CONDOMINIO ESTRELAS DO MAR;R GOTHARDO MORAES 800;DE LOURDES;60177340;FORTALEZA;CE;
10628872000152;EDIFICIO TRAGALUZ;R LEONARDO MOTA 620;MEIRELES;60170040;FORTALEZA;CE;
10629661000134;CONDOMINIO JARDIM FIORE;AV PROF JOSE ARTHUR DE CARVALHO 1622;LGA REDONDA;60831370;FORTALEZA;CE;
10635968000148;CONDOMINIO RESIDENCIAL VILA DE FATIMA;R OLEGARIO MEMORIA 287;SAPIRANGA;60833045;FORTALEZA;CE;
10640523000156;CONDOMINIO RESIDENCIAL JARDINS SAMARIA I;AV PRUDENTE BRASIL 180;PASSARE;60743770;FORTALEZA;CE;
10640953000178;CONDOMINIO PATIO DOM LUIS;AV D LUIS 1200;ALDEOTA;60160196;FORTALEZA;CE;
10651006000182;CONDOMINIO VIENNA;R ANTONIO BANDEIRA 513;ITAPERI;60714170;FORTALEZA;CE;
10661891000180;EDIFICIO VICTOR IX;R TEN AMAURI PIO 57;MEIRELES;60160090;FORTALEZA;CE;
10662117000194;CONDOMINIO SPASSO;AV RECREIO 180;LGA REDONDA;60831600;FORTALEZA;CE;
10676899000110;CONDOMINIO ASTURIAS RESIDENCE;R DOIS 600 LT CIDADE SUL PRQ DE;SERRINHA;60742766;FORTALEZA;CE;
10681693000189;EDIFICIO SAN MARINO;R MIGUEL GONCALVES 66;MONTESE;60420480;FORTALEZA;CE;
10721026000182;CONDOMINIO ED FRANCISCO TORQUILHO;R CASTRO E SILVA 928;CENTRO;60030010;FORTALEZA;CE;
10721763000185;CONDOMINIO WANDA FERREIRA COSTA;R IMA BAZET 470;MONTESE;60420670;FORTALEZA;CE;
10724984000107;CONDOMINIO PORTO PRINCIPE;R DAS CARNAUBAS 570;PASSARE;60743780;FORTALEZA;CE;
10725481000156;EDIFICIO SOBERANO III;R MARGARIDA MARIA 1010;PRES KENNEDY;60355501;FORTALEZA;CE;
10728212000143;CONDOMINIO ED MAISON BLANCHE;AV RUI BARBOSA 880;ALDEOTA;60115221;FORTALEZA;CE;
10729312000194;CONDOMINIO RESIDENCIAL ACROPOLE;R CREUZA ROQUE 559;MANUEL SATIRO;60713330;FORTALEZA;CE;
10731286000139;CONDOMINIO IMPERIAL RESIDENCE;R MANUEL TEIXEIRA 895;JOSE DE ALENCAR;60830345;FORTALEZA;CE;
10741677000134;CONDOMINIO ED BRISA LESTE;R JOVINO GUEDES 60;ALDEOTA;60140130;FORTALEZA;CE;
10748329000199;CONDOMINIO ED GILBERTO STUDART;R DR GILBERTO STUDART 1560;COCO;60192095;FORTALEZA;CE;
10751013000156;CONDOMINIO RESIDENCIAL UIRAPURU;AV ALBERTO CRAVEIRO 2111;BOA VISTA;60861211;FORTALEZA;CE;
10751210000175;CONDOMINIO RESIDENCIAL DOM SEBASTIAN;R PEDRO MEDEIROS 49;MONTESE;60410260;FORTALEZA;CE;
10755589000191;EDIFICIO PORTAL MEIRELES;R BARBOSA DE FREITAS 123;MEIRELES;60170020;FORTALEZA;CE;
10767553000128;RESIDENCIAL JARDINS DE IRACEMA;R DRAGAO DO MAR 531;PR DE IRACEMA;60060390;FORTALEZA;CE;
10787523000183;CONDOMINIO MANUEL ALVES DE LIMA;R WALTER POMPEU 540;ALVARO WEYNE;60337120;FORTALEZA;CE;
10796098000199;CODOMINIO RESIDENCIAL JOSE JONATAS;R JOAO SORONGO 1016;DAMAS;60425784;FORTALEZA;CE;
10809915000104;CONDOMINIO DO ED PARC DE LIBERTE;R PROF JACINTO BOTELHO 650;PATRIOLINO RIBEIRO;60810050;FORTALEZA;CE;
10822001000175;CONDOMINIO DO ED RESIDENCIAL SAN MARINO;R MANOEL MONTEIRO 540;CIDADE DOS FUNCIONARIOS;60822080;FORTALEZA;CE;
10828131000115;RESIDENCIAL ATLANTICO;R PE PEDRO DE ALENCAR 1881;PAUPINA;60872560;FORTALEZA;CE;
10855191000127;CONDOMINIO ED DIPL I;R GEN BERNARDO FIGUEIREDO 2833 AND;PARQUELANDIA;60455440;FORTALEZA;CE;
10881351000102;CONDOMINIO RESIDENCIAL EULALIO BORGES;R JONAS SAMPAIO 345;JOSE DE ALENCAR;60830465;FORTALEZA;CE;
10886159000109;CONDOMINIO VILA SAFIRA;R MARIA IVONE 175;EDSON QUEIROZ;60834472;FORTALEZA;CE;
10888073000115;CONDOMINIO GREEN VILLAGE;R AURINO COLARES 85;LGA REDONDA;60831435;FORTALEZA;CE;
10888079000192;CONDOMINIO OLIVER RESIDENCE;R VICENTE LOPES 400;CIDADE DOS FUNCIONARIOS;60822104;FORTALEZA;CE;
10888351000134;EDIFICIO PORT KIEV;R VILEBALDO AGUIAR 1400;COCO;60192025;FORTALEZA;CE;
10904489000180;RESIDENCIAL VALE DOS JARDINS;R LEOPOLDO PEREZ 351;ENG LUCIANO CAVALCANTE;60811235;FORTALEZA;CE;
10934128000186;CONDOMINIO PARQUE DAS CARNAUBAS;R DAS CARNAUBAS 441;PASSARE;60743780;FORTALEZA;CE;
10936757000145;RESIDENCIAL JARDINS DO SUL;R AMANCIO PEREIRA 471;PASSARE;60861770;FORTALEZA;CE;
10939777000170;CONDOMINIO RESIDENCIAL AGHATOS;AV JUSCELINO KUBITSCHEK 3535;PASSARE;60861630;FORTALEZA;CE;
10960396000172;CONDOMINIO ED LUIZA TAVORA;R CARLOS VASCONCELOS 1090;ALDEOTA;60115171;FORTALEZA;CE;
10970230000137;CONDOMINIO RESIDENCIAL MATIAS BECK;R MNS DANTAS 100;JACARECANGA;60010436;FORTALEZA;CE;
10982396000173;EDIFICIO BERGAMO;TV HILNETE 99;DIONISIO TORRES;60135210;FORTALEZA;CE;
10982400000101;RESIDENCIAL MONTE CARLO;R MARGARIDA QUEIROS 580;CIDADE DOS FUNCIONARIOS;60822530;FORTALEZA;CE;
10987531000173;CONDOMINIO DO ED ANDORRA;R THOMAZ POMPEU 30;MEIRELES;60160080;FORTALEZA;CE;
10992321000173;CONDOMINIO RESIDENCIAL PALAZZO DI FATIMA;R JUVENAL DE CARVALHO 1044;FATIMA;60050220;FORTALEZA;CE;
10993322000132;CONDOMINIO GREEN PARADISE CLUB 02;AV MR HULL 2933;PRES KENNEDY;60356001;FORTALEZA;CE;
10994981000193;RESIDENCIAL PARQUE NOVA NEOPOLIS;R RIO JORDAO 1190;JANGURUSSU;60870730;FORTALEZA;CE;
10999349000132;CONDOMINIO BRISAS MARINHAS;R TEATROLOGO SILVANO SERRA 570;DE LOURDES;60177050;FORTALEZA;CE;
11003111000178;CONDOMINIO ED SION;R FAUSTO CABRAL 1131;PAPICU;60175415;FORTALEZA;CE;
11007593000134;CONDOMINIO JARDINS DE VENEZA;R CEL ALVES RIBEIRO 233;MESSEJANA;60842220;FORTALEZA;CE;
11012977000145;CONDOMINIO ED VENEZA;R MOREIRA GOMES 701;VL UNIAO;60410722;FORTALEZA;CE;
11018733000170;CONDOMINIO RESIDENCIAL VILLA VERANA;R LEON GRADVOL 213;MARAPONGA;60711155;FORTALEZA;CE;
11022307000100;EDIFICIO SABATINI;R ANDRE DALL OLIO 491;PAPICU;60175195;FORTALEZA;CE;
11022370000146;EDIFICIO LIS DU PARC;AV ENG SANTANA JUNIOR 2977;COCO;60175650;FORTALEZA;CE;
11035937000119;CONDOMINIO RESIDENCIAL GRAN CARMEL;R RAFAEL TOBIAS 2240;JOSE DE ALENCAR;60830105;FORTALEZA;CE;
11036220000191;CONDOMINIO POLO MEGA MIX;R DR RATISBONA 565;FATIMA;60411220;FORTALEZA;CE;
11049394000199;CONDOMINIO RESIDENCIAL VANCOUVER;R EVARISTO DA VEIGA 825;MESSEJANA;60841415;FORTALEZA;CE;
11068608000174;CONDOMINIO ED AGUAS BELAS;AV ANTONIO JUSTA 2880;MEIRELES;60165090;FORTALEZA;CE;
11068657000107;CONDOMINIO DO ED SOLARIUM;R TIBURCIO CAVALCANTE 134;MEIRELES;60125100;FORTALEZA;CE;
11068665000153;CONDOMINIO ED MONTERREY;R AFONSO CELSO 225;ALDEOTA;60140190;FORTALEZA;CE;
11071719000130;CONDOMINIO DR FAHAD OTOCH;R REPUBLICA DO LIBANO 120;MEIRELES;60160140;FORTALEZA;CE;
11084153000180;CONDOMINIO ED ANTONIO FRADIQUE ACCIOLY;R OSVALDO CRUZ 3485;S JOAO DO TAUAPE;60120325;FORTALEZA;CE;
11087763000138;CONDOMINIO MAISON ISABEL;R EDUARDO GARCIA 920;ALDEOTA;60150100;FORTALEZA;CE;
11087764000182;CONDOMINIO DO ED PORTAL DA ENSEADA;VL PRES KENNEDY 3870;BELA VISTA;60441414;FORTALEZA;CE;
11087863000164;CONDOMINIO ED VENEZA II;R PAULA NEY 155;ALDEOTA;60140200;FORTALEZA;CE;
11087921000150;CONDOMINIO COLUMBIA;R VILEBALDO AGUIAR 401;COCO;60192010;FORTALEZA;CE;
11087939000151;CONDOMINIO RESIDENCIAL CARLOS FREDERICO;R PRIMEIRO DE JULHO 30;COUTO FERNANDES;60442048;FORTALEZA;CE;
11087962000146;CONDOMINIO PARQUE VILA VERDE;R NEWTON CRAVEIRO 120;PRQ IRACEMA;60824220;FORTALEZA;CE;
11088135000177;CONDOMINIO DO ED BRUNO AGUIAR PESSOA;R BENI CARVALHO 225;ALDEOTA;60135400;FORTALEZA;CE;
11088267000107;CONDOMINIO DOS EDIFICIOS GLORINHA PESTANA E TATIANA;AV BR DE STUDART 1966;ALDEOTA;60120024;FORTALEZA;CE;
11088432000112;CONDOMINIO ED ANA ZULEIKA;AV ANTONIO SALES 2199;DIONISIO TORRES;60135203;FORTALEZA;CE;
11088465000162;CONDOMINIO DO ED PARTHENON;R CANUTO DE AGUIAR 1050 TER;MEIRELES;60160120;FORTALEZA;CE;
11088481000155;CONDOMINIO DO ED LECORBUSIER;R NUNES VALENTE 1571;ALDEOTA;60125035;FORTALEZA;CE;
11088515000101;CONDOMINIO ED VERSAILLES;R ANA BILHAR 88;MEIRELES;60160110;FORTALEZA;CE;
11089062000138;CONDOMINIO RESIDENCIAL BUGANVILIA II;R S CIPRIANO 65;PASSARE;60861780;FORTALEZA;CE;
11089634000189;CONDOMINIO GRAND VILLAGIO RESIDENCE;R DR AIRTON BEZERRA 755;JOSE DE ALENCAR;60830545;FORTALEZA;CE;
11095435000183;EDIFICIO PEROLA DE FATIMA;R SALDANHA MARINHO 750;JOSE BONIFACIO;60040234;FORTALEZA;CE;
11097189000107;CONDOMINIO LAGUNA VILLE;AV MTO LISBOA 3333;LGA REDONDA;60832402;FORTALEZA;CE;
11108884000119;CONDOMINIO ASIA IMPERIAL;R RAFAEL TOBIAS 2185;JOSE DE ALENCAR;60830105;FORTALEZA;CE;
11111450000178;CONDOMINIO RESIDENCIAL LEANDRU S CDM;R FAUSTO AGUIAR 150;PRQ IRACEMA;60824130;FORTALEZA;CE;
11113979000120;CONDOMINIO DO ED REGENTE;AV DA ABOLICAO 3235;MEIRELES;60165081;FORTALEZA;CE;
11123912000177;RESIDENCIAL CAMINHO DAS AGUAS;R JOSE GAUDENCIO MOREIRA 55;LGA REDONDA;60831078;FORTALEZA;CE;
11124645000152;CONDOMINIO ALTINA LEMOS;R AGAPITO DOS SANTOS 609;CENTRO;60010250;FORTALEZA;CE;
11141609000105;OFFICE PLAZA BUSINESS CENTER;R VICENTE LINHARES 500;ALDEOTA;60135270;FORTALEZA;CE;
11142983000117;EDIFICIO PAPAITIL;R ANTONIO AUGUSTO 3030;JOAQUIM TAVORA;60110533;FORTALEZA;CE;
11145066000196;CONDOMINIO JARDINS SAMARIA II;R BENVINDA 133;PASSARE;60861340;FORTALEZA;CE;
11168729000198;EDIFICIO PRISCILA LINHARES BURGOS;R JOAQUIM SA 20;JOAQUIM TAVORA;60130050;FORTALEZA;CE;
11169721000146;CONDOMINIO DO ED ANCORADOURO;AV BEIRA MAR 4777;MUCURIPE;60165121;FORTALEZA;CE;
11175547000144;CONDOMINIO GIARDINI MILANO;AV GODOFREDO MACIEL 155;PARANGABA;60710001;FORTALEZA;CE;
11193231000185;EDIFICIO TAO RESIDENCE;R DR GILBERTO STUDART 1949;COCO;60192115;FORTALEZA;CE;
11210373000103;CONDOMINOS DO CONDOMINIO RESIDENCIAL;AV 13 DE ABRIL 270 ;VILA UNIAO;60411055;FORTALEZA;CE;
11227973000184;CONDOMINIO FECHADO QUATRO ESTACOES;R CASTRO VIEIRA 13240;PLANALTO AYRTON SENNA;60760300;FORTALEZA;CE;
11233667000150;CONDOMINIO RESIDENCIAL SAN GERARDO;R BILL CARTAXO 885;SAPIRANGA;60833185;FORTALEZA;CE;
11233973000197;CONDOMINIO RESIDENCIAL OURO VERDE;R MARIA QUINTINO 1140;PRQ STA MARIA;60873010;FORTALEZA;CE;
11237587000173;RESIDENCIAL ACUCENAS;R DOS SABIAS 505;PASSARE;60743830;FORTALEZA;CE;
11247141000120;EDIFICIO TERLIZZY;R PROF DIAS DA ROCHA 1634;ALDEOTA;60170285;FORTALEZA;CE;
11247722000161;RESIDENCIAL TICIANA;R DOS JATOBAS 361;PASSARE;60743840;FORTALEZA;CE;
11259162000165;CONDOMINIO RESIDENCIAL PARAISO DA MARAPONGA;R FRANCISCO GLICERIO 722;MARAPONGA;60711055;FORTALEZA;CE;
11271843000149;CONDOMINIO ED AGATHA;R ANTONIO AUGUSTO 852;MEIRELES;60110370;FORTALEZA;CE;
