23416984000191;EDIFICIO JARDINS DO ALGARVE;R DR ADJEMIR PARAHYBA 90;ENG LUCIANO CAVALCANTE;60811270;FORTALEZA;CE;
23443476000100;EDMUNDO VITORIANO;R PINTO MADEIRA 777;CENTRO;60150000;FORTALEZA;CE;
23443492000195;EDIFICIO SOLAR DA PRAIA;R PAULA BARROS 45;MEIRELES;60170060;FORTALEZA;CE;
23443542000134;CONDOMINIO TIBURCIO CAVALCANTE;R TIBURCIO CAVALCANTE 1020;ALDEOTA;60125045;FORTALEZA;CE;
23444292000157;CONDOMINIO SAMUEL LINS CAVALCANTE;R ADOLFO SIQUEIRA 351;JOAQUIM TAVORA;60135140;FORTALEZA;CE;
23446828000173;RESIDENCIAL SOLAR DE FATIMA;R DR COSTA ARAUJO 800;FATIMA;60040620;FORTALEZA;CE;
23467509000144;CONDOMINIO SOL MAIOR;R SEN MACHADO 180;MUCURIPE;60165170;FORTALEZA;CE;
23467558000187;CONDOMINIO DO RESIDENCIAL DANIELLE;R PE MIGUELINHO 589;FATIMA;60040300;FORTALEZA;CE;
23467673000151;CONDOMINIO ED TREVO;R PE CHEVALIER 484;JOAQUIM TAVORA;60130080;FORTALEZA;CE;
23467707000108;CONDOMINIO PARQUE MORABEM;R GERMANO FRANCK 375;PARANGABA;60740020;FORTALEZA;CE;
23467764000197;CONDOMINIO ED JEAN PAUL SARTRE;R JOSE NAPOLEAO 277;MEIRELES;60170210;FORTALEZA;CE;
23467772000133;CONDOMINIO ED TERRAL;R PTO ANTONIO BANDEIRA 3101;VICENTE PINZON;60182308;FORTALEZA;CE;
23469182000140;CONDOMINIO DOS EDIFICIOS ELCIMAR ELIANE E CRISTIANE;R PROF VALDIVINO 2527;SABIAGUABA;60835275;FORTALEZA;CE;
23469406000113;CONDOMINIO DO ED DOS ANJOS CORREIA;R MARIA MIRIAN FERREIRA DE SOUZA 400;PRES KENNEDY;60355642;FORTALEZA;CE;
23469414000160;CONDOMINIO DO ED SAGARANA;AV SEN VIRGILIO TAVORA 1525;ALDEOTA;60170079;FORTALEZA;CE;
23469497000197;CONDOMINIO ED MADRI;R ANTONIO AUGUSTO 1679;ALDEOTA;60110371;FORTALEZA;CE;
23469554000138;SANTOS DUMONT CENTER;AV SANTOS DUMONT 905;CENTRO;60150160;FORTALEZA;CE;
23469646000118;CONDOMINIO CENTRO COML BARROS LEAL;AV SANTOS DUMONT 1267;ALDEOTA;60150161;FORTALEZA;CE;
23469653000110;CONDOMINIO ED PLAZA DEL MAR;R VSC DE MAUA 75;MEIRELES;60125160;FORTALEZA;CE;
23469778000140;CONDOMINIO ED GUARACY;AV BEZERRA DE MENEZES 1172 HALL;S GERARDO;60325001;FORTALEZA;CE;
23469851000183;CONDOMINIO ED MIRAMAR;R JOSE NAPOLEAO 153;MEIRELES;60170210;FORTALEZA;CE;
23469885000178;CONDOMINIO ED LUCIA MELO;AV RUI BARBOSA 748;MEIRELES;60115220;FORTALEZA;CE;
23469901000122;CONDOMINIO ED PAPILON;R ANA BILHAR 305;MEIRELES;60160110;FORTALEZA;CE;
23470032000156;CONDOMINIO VILLAGE SUNSHINE BOULEVARD;R JOAO ARARIPE 60;FATIMA;60410750;FORTALEZA;CE;
23470107000107;CONDOMINIO DO ED RUI BARBOSA;AV RUI BARBOSA 1648;ALDEOTA;60115221;FORTALEZA;CE;
23470115000145;CONDOMINIO ED CASA BLANCA;R G 3811;MANOEL DIAS BRANCO;60191070;FORTALEZA;CE;
23470131000138;CONDOMINIO JARDIM OPAIA;AV LUCIANO CARNEIRO 2585;VL UNIAO;60410691;FORTALEZA;CE;
23470156000131;CONDOMINIO ED PATRICIA;R GONCALVES LEDO 677;ALDEOTA;60110260;FORTALEZA;CE;
23479025000115;CONDOMINIO DO ED KAMAYURA;AV RUI BARBOSA 2160;JOAQUIM TAVORA;60115222;FORTALEZA;CE;
23479090000140;CONDOMINIO DO ED JUREMA;R DA PAZ 220;PRQ GENIBAU;60534820;FORTALEZA;CE;
23479389000103;CONDOMINIO ED COLINA DO SOL;R GONCALVES LEDO 177;ALDEOTA;60110260;FORTALEZA;CE;
23479439000144;CONDOMINIO VILLAGE SUNSHINE BOULEVARD I;R JOAO ARARIPE 120;FATIMA;60410750;FORTALEZA;CE;
23479488000187;CONDOMINIO ED TOM JOBIM;R JOAQUIM NABUCO 1300;ALDEOTA;60125055;FORTALEZA;CE;
23479561000110;CONDOMINIO RESIDENCIAL DO PORTUGUES;AV JOAO PESSOA 4693;DAMAS;60425813;FORTALEZA;CE;
23479603000113;CONDOMINIO RESIDENCIAL PARQUE ATLANTICO;R ALVARO FERNANDES 243;MONTESE;60420570;FORTALEZA;CE;
23490303000135;CONDOMINIO DO RESIDENCIAL JOAO PAULO II;R MUNDICA PAULA 681;ITAOCA;60421410;FORTALEZA;CE;
23490311000181;CONDOMINIO MARCOS MACEDO;R MARCOS MACEDO 247;ALDEOTA;60150190;FORTALEZA;CE;
23490352000178;CONDOMINIO PLANALTO ALDEOTA SUL;R ESVAO AZEVEDO 791;CIDADE DOS FUNCIONARIOS;60822520;FORTALEZA;CE;
23490428000165;CONDOMINIO ED PRCA ISABEL;R PRCA ISABEL 1618;FARIAS BRITO;60015061;FORTALEZA;CE;
23497746000158;CONDOMINIO DO ED LUCAS MENDES;R ENG SABOIA RIBEIRO 7810;ANTONIO DIOGO;60182460;FORTALEZA;CE;
23497910000127;CONDOMINIO RESIDENCIAL JOSE BASTOS;TV AUGUSTO DOS ANJOS 240 BL 1 AP 104;JOQUEI CLUBE;60520214;FORTALEZA;CE;
23497993000154;CONDOMINIO ED CARMEN;R COSTA BARROS 2373;ALDEOTA;60160281;FORTALEZA;CE;
23498009000170;CONDOMINIO CANTO DO TIE;R ANDRADE FURTADO 2251;COCO;60192085;FORTALEZA;CE;
23498074000103;EDIFICIO PEREIRA VALENTE;R PEREIRA VALENTE 720;MEIRELES;60160250;FORTALEZA;CE;
23498108000151;CONDOMINIO ED MONTEHERMON;R FR MANSUETO 1500;ALDEOTA;60175082;FORTALEZA;CE;
23498124000144;CONDOMINIO LECONCORD;R DR JOSE LOURENCO 955;ALDEOTA;60115281;FORTALEZA;CE;
23498199000125;CONDOMINIO DO ED VIVENDA SERENA;R EUSEBIO DE SOUSA 1392;JOSE BONIFACIO;60050110;FORTALEZA;CE;
23498249000174;CONDOMINIO DO ED SAN MAGNUM;R RAIMUNDO OLIVEIRA FILHO 133;PAPICU;60175175;FORTALEZA;CE;
23498348000156;CONDOMINIO ED ITAPOA;R JOAQUIM NABUCO 2360;DIONISIO TORRES;60125121;FORTALEZA;CE;
23498355000158;CONDOMINIO ED EMILIA;AV WASHINGTON SOARES 515;EDSON QUEIROZ;60811341;FORTALEZA;CE;
23498389000142;CONDOMINIO ED BETAVILLE;R NUNES VALENTE 2380;DIONISIO TORRES;60125071;FORTALEZA;CE;
23530595000192;CONDOMINIO ED JARDIM EUROPA;R CATAO MAMEDE 780;ALDEOTA;60140110;FORTALEZA;CE;
23530645000131;CONDOMINIO ED HELENA;R CESAR FONSECA 388;COCO;60192260;FORTALEZA;CE;
23530702000182;CONDOMINIO ED RIVOLI;R ISAAC AMARAL 580;DIONISIO TORRES;60130120;FORTALEZA;CE;
23530728000120;CONDOMINIO ED ANGELA;R FONSECA LOBO 1528;ALDEOTA;60175020;FORTALEZA;CE;
23530793000156;CONDOMINIO JARDIM ALDEOTA;AV BR DE STUDART 3103;DIONISIO TORRES;60120375;FORTALEZA;CE;
23530884000191;CONDOMINIO DO ED MACONDO;R FONSECA LOBO 1191;ALDEOTA;60175020;FORTALEZA;CE;
23530934000130;RESIDENCIAL GONCALVES LEDO;R GONCALVES LEDO 2923;ALDEOTA;60110260;FORTALEZA;CE;
23530942000187;CONDOMINIO DO ED PONTA LESTE;R BENTO ALBUQUERQUE 399;PAPICU;60190080;FORTALEZA;CE;
23530967000180;CONDOMINIO ED SAN SIRO;R BR DE ARACATI 800;MEIRELES;60115080;FORTALEZA;CE;
23530975000127;CONDOMINIO RESIDENCIAL MENDES FREIRE;R CEL JOAO CARNEIRO 67;FATIMA;60040560;FORTALEZA;CE;
23531049000176;CONDOMINIO ED IDEAL;R DONDON FEITOSA 35;DAMAS;60426090;FORTALEZA;CE;
23531098000109;CONDOMINIO ED ANDROS;R JOAO ARARIPE 30;FATIMA;60410750;FORTALEZA;CE;
23531130000156;CONDOMINIO MORADA DO MAR;AV CESAR CALS 3444;ANTONIO DIOGO;60182405;FORTALEZA;CE;
23531197000190;CONDOMINIO ED MOUNT ROYAL;TV JOSE LOURENCO 1990;PLANALTO AYRTON SENNA;60760552;FORTALEZA;CE;
23549500000182;EDIFICIO COLIBRI;R THOMAZ POMPEU 49;MEIRELES;60160080;FORTALEZA;CE;
23553381000131;CONDOMINIO PARQUE ALDEOTA SUL;R ESVAO AZEVEDO 640;CIDADE DOS FUNCIONARIOS;60822520;FORTALEZA;CE;
23553431000180;CONDOMINIO ED CASTELL;R CANUTO DE AGUIAR 950;MEIRELES;60160120;FORTALEZA;CE;
23553480000113;CONDOMINIO ED TORRES;R JOSE NAPOLEAO 303;MEIRELES;60170210;FORTALEZA;CE;
23553761000176;CONDOMINIO DO ED PLANALTO I;R PE VALDEVINO 2015;ALDEOTA;60135041;FORTALEZA;CE;
23553779000178;CONDOMINIO ED ANNA LUIZA E ANNA CRISTINA;R CEL LINHARES 2400;DIONISIO TORRES;60170241;FORTALEZA;CE;
23553787000114;CONDOMINIO ED VALPARAISO;R DR GILBERTO STUDART 2250;COCO;60192115;FORTALEZA;CE;
23553803000179;CONDOMINIO JOSE MARIA ROCHA MONTEIRO;AV ANTONIO SALES 2155 AND SL 106 1;DIONISIO TORRES;60135203;FORTALEZA;CE;
23553860000158;CONDOMINIO ED POTOMAC;R D JOSE LOURENCO 2270;AMADEU FURTADO;60455525;FORTALEZA;CE;
23553886000104;CONDOMINIO DO ED SARAH;R PASCOAL DE CASTRO ALVES 140;VICENTE PINZON;60181225;FORTALEZA;CE;
23553902000150;CONDOMINIO DO ED MARIANA;R TOMAS ACIOLI 831;JOAQUIM TAVORA;60135180;FORTALEZA;CE;
23553951000193;CONDOMINIO ED ROMA;R BENTO ALBUQUERQUE 1500 HALL;COCO;60192055;FORTALEZA;CE;
23553977000131;CONDOMINIO DO ED MEDELLIN;R ANA BILHAR 770;MEIRELES;60160110;FORTALEZA;CE;
23554090000168;CONDOMINIO ED LIEGE;R SEN POMPEU 2508;JOSE BONIFACIO;60025001;FORTALEZA;CE;
23554249000144;CONDOMINIO DO ED PEROLA;VL PRES KENNEDY 3300;BELA VISTA;60441414;FORTALEZA;CE;
23554256000146;CONDOMINIO ED JARDIM MONTE CASTELO;R ANTONINA DO NORTE 194;S GERARDO;60325610;FORTALEZA;CE;
23554280000185;CONDOMINIO JARDIM ANTARES;R GEN SILVA JUNIOR 700;FATIMA;60411200;FORTALEZA;CE;
23554348000126;CONDOMINIO ED APENINOS;R SILVA PAULET 255 255;MEIRELES;60120020;FORTALEZA;CE;
23554421000160;QUARUP;R TAVARES COUTINHO 1696;VARJOTA;60160130;FORTALEZA;CE;
23554470000100;CONDOMINIO ED MARAMBAIA;AV DEDE BRASIL 3850;SERRINHA;60740000;FORTALEZA;CE;
23554488000102;CONDOMINIO DO ED DIAMANTE;R GEN TERTULIANO POTIGUARA 555;ALDEOTA;60135280;FORTALEZA;CE;
23554496000140;CONDOMINIO ED SAN THIAGO;AV ENG ALBERTO SA 231;PAPICU;60175395;FORTALEZA;CE;
23554504000159;CONDOMINIO ED ATENAS;R CARAPINIMA 1821;BENFICA;60015290;FORTALEZA;CE;
23554538000143;CONDOMINIO ED BONAVENTURE I;R REPUBLICA DO LIBANO 620;MEIRELES;60160140;FORTALEZA;CE;
23554546000190;CONDOMINIO ED MAISON CARTIER;TV VICENTE LEITE 856;ALDEOTA;60170160;FORTALEZA;CE;
23554579000130;CONDOMINIO ED LAIS;R DR FRANCISCO MATOS 310;COCO;60192240;FORTALEZA;CE;
23554595000122;CENTRO EMPRESARIAL CLOVIS ROLIM;R PEDRO BORGES 20;CENTRO;60055110;FORTALEZA;CE;
23554678000111;CONDOMINIO ED HERMANN HESSE;R CEL LINHARES 2290 ED;DIONISIO TORRES;60170241;FORTALEZA;CE;
23554702000112;CONDOMINIO DO ED MONTPELLIER;R PEREIRA DE MIRANDA 750;PAPICU;60175045;FORTALEZA;CE;
23554793000196;CONDOMINIO SAN RAPHAEL;R MNS BRUNO 2630;JOAQUIM TAVORA;60115046;FORTALEZA;CE;
23555147000143;CONDOMINIO ED T LACERDA;R BR DE ARACATI 1393;ALDEOTA;60115081;FORTALEZA;CE;
23555162000191;CONDOMINIO DO ED ANDREZA;R MNS FURTADO 994;RODOLFO TEOFILO;60430355;FORTALEZA;CE;
23555188000130;CONDOMINIO ED IRACY;R OSVALDO CRUZ 1750;ALDEOTA;60125048;FORTALEZA;CE;
23555204000194;CONDOMINIO D LUIZ;R G 890;MANOEL DIAS BRANCO;60191070;FORTALEZA;CE;
23555261000173;CONDOMINIO ED JOSE LOURENCO;TV JOSE LOURENCO 1931;PLANALTO AYRTON SENNA;60760552;FORTALEZA;CE;
23555287000111;CONDOMINIO ED MORADA DAS GARCAS;R EMIDIO LOBO 90;PAPICU;60176090;FORTALEZA;CE;
23555303000176;CONDOMINIO DO ED SAINT EXUPERY;R PEDRO RUFINO 135;VARJOTA;60175100;FORTALEZA;CE;
23555337000160;LUCIANO CARNEIRO;AV LUCIANO CARNEIRO 2365;VL UNIAO;60410691;FORTALEZA;CE;
23562705000106;CONDOMINIO DO ED BOUGAINVILLE;AV RUI BARBOSA 690;MEIRELES;60115220;FORTALEZA;CE;
23562713000144;CONDOMINIO DO ED CATIA;R TOMAS ACIOLI 340;JOAQUIM TAVORA;60135180;FORTALEZA;CE;
23562770000123;CONDOMINIO ED CONTEP I;R NOGUEIRA ACIOLI 1365;CENTRO;60110140;FORTALEZA;CE;
23562788000125;CONDOMINIO ED LIEGE II;R SEN POMPEU 2508;JOSE BONIFACIO;60025001;FORTALEZA;CE;
23562796000171;CONDOMINIO RESIDENCIAL MACEDO I;R JOSE RANGEL 179;PAPICU;60176100;FORTALEZA;CE;
23562838000174;CONDOMINIO ED ANGRA DOS REIS;R PROF FRANCISCO GONCALVES 350;DIONISIO TORRES;60135430;FORTALEZA;CE;
23562887000107;CONDOMINIO DO ED CRISTO REI;R NOGUEIRA ACIOLI 1050;CENTRO;60110140;FORTALEZA;CE;
23562895000153;CONDOMINIO ED OURO PRETO;R JOSE VILAR 2360;DIONISIO TORRES;60125001;FORTALEZA;CE;
23562945000100;CONDOMINIO ED SAINT TROPEZ;R GEN TERTULIANO POTIGUARA 700;ALDEOTA;60135280;FORTALEZA;CE;
23562952000102;CONDOMINIO ED ALDEBARAN;R ANTONELE BEZERRA 336;MEIRELES;60160070;FORTALEZA;CE;
23562986000199;CONDOMINIO DO ED MELISSA;R JOAO BRIGIDO 1956;JOAQUIM TAVORA;60135080;FORTALEZA;CE;
23563018000105;CONDOMINIO ED NOVO CONTINENTE;R OSVALDO CRUZ 3020;DIONISIO TORRES;60125151;FORTALEZA;CE;
23563042000136;CONDOMINIO SOLAR DOS EVANGELISTAS BLOCO B;R PRCA ISABEL 1783;FARIAS BRITO;60015061;FORTALEZA;CE;
23563059000193;CONDOMINIO ED JUVENCIO CAMARA;R NUNES VALENTE 1440;ALDEOTA;60125035;FORTALEZA;CE;
23563075000186;CONDOMINIO DR GARCEZ FILHO;R DELMIRO GOUVEIA 1155 BL C;VARJOTA;60175090;FORTALEZA;CE;
23563083000122;CONDOMINIO ED GOLDEN STAR RESIDENCE;VL PRES KENNEDY 3660;BELA VISTA;60441414;FORTALEZA;CE;
23563091000179;CONDOMINIO MAGNA SANTOS DUMONT;AV SANTOS DUMONT 2525;ALDEOTA;60150165;FORTALEZA;CE;
23563125000125;CONDOMINIO RESIDENCIAL VERA CRUZ;R ANARIO BRAGA 100;ANTONIO BEZERRA;60350350;FORTALEZA;CE;
23563133000171;CONDOMINIO ED VIENA;R MARCOS MACEDO 1390;ALDEOTA;60150190;FORTALEZA;CE;
23563141000118;CONDOMINIO ED IVIMARAI;R BARBOSA DE FREITAS 130;MEIRELES;60170020;FORTALEZA;CE;
23563166000111;CONDOMINIO DO ED FRANCISCO THALES;R AQUILES BEVILAQUA 160;JOAQUIM TAVORA;60135150;FORTALEZA;CE;
23563216000160;EDIFICIO ITAPUA ED ITAPARICA ED ITAMARACA;AV ALVARO CORREIA 595;MUCURIPE;60165230;FORTALEZA;CE;
23563315000142;EDIFICIO TOP CENTER;AV D LUIS 880;ALDEOTA;60160196;FORTALEZA;CE;
23563372000121;CONDOMINIO ED PALESTINA I;R JUSTINIANO DE SERPA 588;FARIAS BRITO;60011110;FORTALEZA;CE;
23563406000188;CONDOMINIO ED COMODORO;R OLIVEIRA FILHO 1575;VICENTE PINZON;60181816;FORTALEZA;CE;
23563414000124;CONDOMINIO DO CONJUNTO RESIDENCIAL SANTA BARBARA;R TIBURCIO RODRIGUES 100;S JOAO DO TAUAPE;60130450;FORTALEZA;CE;
23568918000137;CONDOMINIO ED FONTAINEBLEAU;R CARLOS VASCONCELOS 170;MEIRELES;60115170;FORTALEZA;CE;
23568975000116;CONDOMINIO ED SAN MARTIN;R PROF FRANCISCO MOREIRA 330;PR DO FUTURO;60182450;FORTALEZA;CE;
23569049000165;CONDOMINIO MARIA ALICE FERRAZ;TV VICENTE LEITE 2120;ALDEOTA;60170160;FORTALEZA;CE;
23569130000145;CONDOMINIO DOS EDIFICIOS SANDRINHA E PAULINHA;R JOAQUIM NABUCO 965 985;ALDEOTA;60125055;FORTALEZA;CE;
23569189000133;CONDOMINIO RESIDENCIAL LAGOA;R RIO GRANDE DO SUL 2230;JOQUEI CLUBE;60440214;FORTALEZA;CE;
23569221000180;CONDOMINIO ED ANA PESSOA;R BARBOSA DE FREITAS 2391;DIONISIO TORRES;60170174;FORTALEZA;CE;
23569239000182;CONDOMINIO ED VSC DE MAUA;R VSC DE MAUA 500;MEIRELES;60125160;FORTALEZA;CE;
23569254000120;CONDOMINIO DO ED BONINI;TV VICENTE LEITE 1392;ALDEOTA;60170160;FORTALEZA;CE;
23569262000177;CONDOMINIO ED NEPTUNO;R DOS POTIGUARAS 340;PR DE IRACEMA;60060500;FORTALEZA;CE;
23569288000115;CONDOMINIO PAUL RICHARD;AV PE ANTONIO TOMAS 2400;ALDEOTA;60140160;FORTALEZA;CE;
23569296000161;CONDOMINIO ED KAROL WOJTYLA;R FRANCA 1104;MARAPONGA;60710710;FORTALEZA;CE;
23589542000147;CONDOMINIO ED TALISMA;R MARCOS MACEDO 665;ALDEOTA;60150190;FORTALEZA;CE;
23589559000102;EDIFICIO VILAR;R FISC VIEIRA 4100;S JOAO DO TAUAPE;60120085;FORTALEZA;CE;
23589625000136;EDIFICIO TOME;R JOSE NAPOLEAO 285;MEIRELES;60170210;FORTALEZA;CE;
23589641000129;CONDOMINIO ED VICTOR REIS;R JOAO CORDEIRO 2050;CENTRO;60110300;FORTALEZA;CE;
23589690000161;CONDOMINIO DO ED RITA MARIA;AV DES MOREIRA 2059;ALDEOTA;60170001;FORTALEZA;CE;
23589708000125;CONDOMINIO ED ETA CARENAE;R LEONARDO MOTA 303;MEIRELES;60170040;FORTALEZA;CE;
23589716000171;CONDOMINIO ED CARMEN;R NUNES VALENTE 171;MEIRELES;60125070;FORTALEZA;CE;
23589732000164;CONDOMINIO ED LUCIANA;R VSC DE MAUA 1925;ALDEOTA;60125058;FORTALEZA;CE;
23589757000168;CONDOMINIO D BOSCO;AV OLIVEIRA PAIVA 203;CIDADE DOS FUNCIONARIOS;60822131;FORTALEZA;CE;
23589849000148;CONDOMINIO ED GENTIL CARDOSO;R JUCA 22;S JOAO DO TAUAPE;60135510;FORTALEZA;CE;
23589864000196;CONDOMINIO ED PARIS;R PE MATOS SERRA 145;FATIMA;60040290;FORTALEZA;CE;
23589948000120;CONDOMINIO ED JOAO BEZERRA DE MENEZES;R VSC DE MAUA 2920;DIONISIO TORRES;60125161;FORTALEZA;CE;
23589955000121;CONDOMINIO ED MOISES MENDES;AV BR DE STUDART 2765;DIONISIO TORRES;60120375;FORTALEZA;CE;
23590052000160;CONDOMINIO ED MONTE NEGRO;R SILVA JATAHY 890;MEIRELES;60165070;FORTALEZA;CE;
23590102000100;CONDOMINIO TICIANA MENDES;AV AGUANAMBI 760;FATIMA;60055403;FORTALEZA;CE;
23590144000140;CONDOMINIO ED MODESTO;R TIBURCIO CAVALCANTE 2570;DIONISIO TORRES;60125101;FORTALEZA;CE;
23590391000147;CONDOMINIO ED TOPAZIO;R ANA BILHAR 335;MEIRELES;60160110;FORTALEZA;CE;
23590433000140;CONDOMINIO DO ED INACIO ALVES PARENTE;R PROF DIAS DA ROCHA 490;MEIRELES;60170310;FORTALEZA;CE;
23590680000146;CONDOMINIO EDFICIO FILOMENO;R LIBERATO BARROSO 555;CENTRO;60030160;FORTALEZA;CE;
23597436000105;CONDOMINIO MAYARA RESIDENCE;R ARAUJO TORREAO 215 COND;PRQ IRACEMA;60824190;FORTALEZA;CE;
23611838000117;CONDOMINIO PETIT TRIANON;R NADIR SABOYA 1080;SAPIRANGA;60833344;FORTALEZA;CE;
23638429000104;CONDOMINIO NORTH VILLAGE;R PE MAXIMO FEITOSA 934 COND NORTH VILLAGE;PRES KENNEDY;60355770;FORTALEZA;CE;
23640199000118;SAMUEL BEZERRA;R S MATEUS 1862;VL UNIAO;60410642;FORTALEZA;CE;
23649213000144;CONDOMINIO ED VICENTE DE CASTRO FILHO;R TIBURCIO CAVALCANTE 890;ALDEOTA;60125045;FORTALEZA;CE;
23658222000100;CONDOMINIO DO ED BARBARA DE ALENCAR;R BARBARA DE ALENCAR 1181;ALDEOTA;60140025;FORTALEZA;CE;
23679748000168;CONDOMINIO CAMBEBA MALL;AV MIN JOSE AMERICO 660;PRQ IRACEMA;60824245;FORTALEZA;CE;
23706377000166;CONDOMINIO ED CHARLOTE;R ANDRADE FURTADO 1571;COCO;60192072;FORTALEZA;CE;
23706450000108;CONDOMINIO DO ED ZORIEUQ;R JOAO CORDEIRO 212;PR DE IRACEMA;60060292;FORTALEZA;CE;
23706476000148;CONDOMINIO ED CHAGAS BARRETO;VL ILDEFONSO ALBANO 551;JOAQUIM TAVORA;60115070;FORTALEZA;CE;
23706526000197;CONDOMINIO BOGARI;R EDUARDO BEZERRA 1650;S JOAO DO TAUAPE;60130271;FORTALEZA;CE;
23717192000157;CONDOMINIO DO ED MALIBU;AV ENG ALBERTO SA 1030;PAPICU;60175395;FORTALEZA;CE;
23717218000167;CONDOMINIO ED ISABELLA;R G 2180;MANOEL DIAS BRANCO;60191070;FORTALEZA;CE;
23717283000192;CONDOMINIO DO ED BROADWAY;R NUNES VALENTE 1250;ALDEOTA;60125035;FORTALEZA;CE;
23717291000139;CONDOMINIO ANTONIO CAVALCANTE LINS;AV CESAR CALS 2300;ANTONIO DIOGO;60182385;FORTALEZA;CE;
23717309000100;ED MANOEL MAIA;R CAP OLAVO 998;AEROLANDIA;60850685;FORTALEZA;CE;
23717333000131;CONDOMINIO ED CYNTHIA;R VILEBALDO AGUIAR 2300;COCO;60192035;FORTALEZA;CE;
23717382000174;CONDOMINIO DO ED MURILO;R BATURITE 176;CENTRO;60060180;FORTALEZA;CE;
23717432000113;CONDOMINIO DO ED PARNASO;R PEREIRA FILGUEIRAS 2400;ALDEOTA;60160194;FORTALEZA;CE;
23717440000160;CONDOMINIO ED SILVANA;R CEL LINHARES 1600;ALDEOTA;60170075;FORTALEZA;CE;
23717507000166;CONDOMINIO DO ED FORMA I;R MAL RONDON 281;ALDEOTA;60175060;FORTALEZA;CE;
23717515000102;CONDOMINIO ED TIFFANYS;R CATAO MAMEDE 218;ALDEOTA;60140110;FORTALEZA;CE;
23717549000105;CONDOMINIO ED PATRICIA;R FONSECA LOBO 345;ALDEOTA;60175020;FORTALEZA;CE;
23717580000138;CONDOMINIO ED JOSE LOURENCO;R MARTINHO RODRIGUES 354;FATIMA;60411280;FORTALEZA;CE;
23717606000148;CONDOMINIO CEDRIM DO VOUGA;R JOAQUIM NABUCO 1850;ALDEOTA;60125055;FORTALEZA;CE;
23727217000101;CONDOMINIO DO ED PARSAGADA;R TORRES CAMARA 1010;ALDEOTA;60150060;FORTALEZA;CE;
23727233000196;EDIFICIO CARAJAS;AV FILOMENO GOMES 80;JACARECANGA;60010280;FORTALEZA;CE;
23727241000132;CONDOMINIO ED MEMPHIS;TV ESTADOS UNIDOS 233;MEIRELES;60170270;FORTALEZA;CE;
23727266000136;VERONA;R GUSTAVO SAMPAIO 2075;PARQUELANDIA;60455001;FORTALEZA;CE;
23727282000129;CONDOMINIO DO ED DEL SOL;R CAROLINA SUCUPIRA 1691;ALDEOTA;60140120;FORTALEZA;CE;
23727316000185;CONDOMINIO IRACEMA PRAIA PARK BLOCO II;VL PRES KENNEDY 1020;BELA VISTA;60441414;FORTALEZA;CE;
23727324000121;CONDOMINIO ED GOLDEN FLAT HOT;VL PRES KENNEDY 4260;BELA VISTA;60441414;FORTALEZA;CE;
23727381000100;CONDOMINIO DO TORRES;R TORRES CAMARA 740;ALDEOTA;60150060;FORTALEZA;CE;
23727480000192;CONDOMINIO ED RAMIRO MILFONT;R CANUTO DE AGUIAR 2100;MEIRELES;60160120;FORTALEZA;CE;
23727548000133;CONDOMINIO ED THERESA MENDES;R PROF DIAS DA ROCHA 371;MEIRELES;60170310;FORTALEZA;CE;
23727613000120;CONDOMINIO RESIDENCIAL DE MESSEJANA;R PE PEDRO DE ALENCAR 1720;PRQ STA MARIA;60873082;FORTALEZA;CE;
23727712000102;CONDOMINIO ED OURO BRANCO;R JOSE VILAR 2350;DIONISIO TORRES;60125001;FORTALEZA;CE;
23727720000159;EDIFICIO ALDEBARA;R CESAR CALS 2339;VICENTE PINZON;60183550;FORTALEZA;CE;
23727753000107;CONDOMINIO DO ED OTACILIA CAVALCANTE;R LAURO MAIA 255;JOSE BONIFACIO;60055210;FORTALEZA;CE;
23727787000193;CONDOMINIO ED PROMENADE;R PINHO PESSOA 1289;JOAQUIM TAVORA;60135170;FORTALEZA;CE;
23727803000148;CONDOMINIO RESIDENCIAL COLONIAL SUL;R PAULINO ROCHA 255;GJA LISBOA;60540576;FORTALEZA;CE;
23727837000132;CONDOMINIO LIEGE IV A E B;R MAL DEODORO 519;BENFICA;60020060;FORTALEZA;CE;
23727878000129;CONDOMINIO JOSE OLIVEIRA E SILVA;R DEP MOREIRA DA ROCHA 331;MEIRELES;60160060;FORTALEZA;CE;
23727902000120;CONDOMINIO ED PAL DAS AGUAS;R JAIME VASCONCELOS 397;MUCURIPE;60165260;FORTALEZA;CE;
23728900000155;EDIFICIO CDM CHANCELER;R GUILHERME MOREIRA 160;FATIMA;60040490;FORTALEZA;CE;
23728926000101;CONDOMINIO ED VITORIA;R D JERONIMO 339;FARIAS BRITO;60011170;FORTALEZA;CE;
23728967000190;EDIFICIO STO LOUIS;R ISRAEL BEZERRA 1080;S JOAO DO TAUAPE;60135472;FORTALEZA;CE;
23728991000129;CONDOMINIO RESIDENCIAL JUA;R HAROLDO TORRES 1050;S GERARDO;60320104;FORTALEZA;CE;
23729015000190;CONDOMINIO ED MARCIA;R BARBOSA DE FREITAS 720;MEIRELES;60170020;FORTALEZA;CE;
23729056000187;CONDOMINIO ED CRISTAL II;R THOMAZ POMPEU 565;MEIRELES;60160080;FORTALEZA;CE;
23729064000123;CONDOMINIO ED VILLAGE PORTO SEGURO;AV ANTONIO JUSTA 3550;MEIRELES;60165090;FORTALEZA;CE;
23729273000177;EDIFICIO PRAIA MARE CONDOMINIUM;R DA PAZ 220;MUCURIPE;60165180;FORTALEZA;CE;
23737323000168;CONDOMINIO ED MONZA;R ALMEIDA PRADO 71;PAPICU;60176085;FORTALEZA;CE;
23737356000108;CONDOMINIO ED VILLA REAL;R NUNES VALENTE 1352;ALDEOTA;60125035;FORTALEZA;CE;
23737372000109;EDIFICIO CNSO ESTELITA;R CNSO ESTELITA 130;CENTRO;60010260;FORTALEZA;CE;
23737406000157;CONDOMINIO ED PALERMO;R NUNES VALENTE 240;MEIRELES;60125070;FORTALEZA;CE;
23737430000196;CONDOMINIO ED JAGUARVILLE;R JOAQUIM NABUCO 643;MEIRELES;60125120;FORTALEZA;CE;
23737448000198;CONDOMINIO JOAO ALVES DE MESQUITA;R ANTONINA DO NORTE 351;S GERARDO;60325610;FORTALEZA;CE;
23737497000120;CONDOMINIO ED ONDINA;R OSVALDO CRUZ 241;MEIRELES;60125150;FORTALEZA;CE;
23737521000121;CONDOMINIO ED MASTER AQUIDABA;AV HISTO RAIMUNDO GIRAO 650;MEIRELES;60165050;FORTALEZA;CE;
23743266000120;EDIFICIO HIPERION;R DA PAZ 390;MUCURIPE;60165180;FORTALEZA;CE;
23803634000188;SUBCONDOMINIO EMPRESARIAL RM KENNEDY;AV SRG HERMINIO SAMPAIO 3100;PRES KENNEDY;60355512;FORTALEZA;CE;
23805399000183;CONDOMINIO VITRAL RESIDENCIAL CLUBE;R COSTA SOUSA 100;BENFICA;60020300;FORTALEZA;CE;
23839705000100;CONDOMINIO DO ED MAISON LIFE;R JOAO CARVALHO 517;ALDEOTA;60140140;FORTALEZA;CE;
23854576000111;CONDOMINIO DO ED SANTA EDWIRGES;R JOSE ADAIL DOS SANTOS 38;PRES KENNEDY;60355631;FORTALEZA;CE;
23891574000100;EDIFICIO MAISON LUANA ROCHA;R JULIO SIQUEIRA 632;DIONISIO TORRES;60135226;FORTALEZA;CE;
24045065000111;RESIDENCIAL HELBOR CDM PARQUE CLUBE FORTALEZA 2;R PEREIRA DE MIRANDA 555;PAPICU;60175045;FORTALEZA;CE;
24046105000140;KYRIUS RESIDENCE;R MARIO MAMEDE 745;FATIMA;60415000;FORTALEZA;CE;
24104693000120;RENAISSANCE RESIDENTE CLUB;R GEN PIRAGIBE 242;PARQUELANDIA;60450255;FORTALEZA;CE;
24118043000134;CONDOMINIO MONTREAL;R GOIAS 1967;JOQUEI CLUBE;60440194;FORTALEZA;CE;
24181725000191;CONDOMINIO RESIDENCIAL DEL MONTE II;R OSIA MONTENEGRO 215;SIQUEIRA;60732544;FORTALEZA;CE;
24251338000184;EDIFICIO PE JOAQUIM DOURADO RESIDENCE;R REV BOLIVAR PINTO BANDEIRA 121;ENG LUCIANO CAVALCANTE;60811310;FORTALEZA;CE;
24276387000171;EDIFICIO SCHUBERT JUNIOR;R VIANA DE CARVALHO 180;MTE CASTELO;60325820;FORTALEZA;CE;
24385477000109;CONDOMINIO SONETO RESIDENCIA;R DR JOSE LOURENCO 816;ALDEOTA;60115281;FORTALEZA;CE;
34985507000163;CONDOMINIO ED MARIA JOSE;R JOAO CORDEIRO 1991;ALDEOTA;60110301;FORTALEZA;CE;
34985549000102;CONDOMINIO DO ED PALMARES;AV JOAO PESSOA 3410;BENFICA;60425680;FORTALEZA;CE;
34985556000104;CONDOMINIO MODERNA ALDEOTA;AV PE ANTONIO TOMAS 4661;COCO;60192120;FORTALEZA;CE;
34985564000142;EDIFICIO TIAGO;AV BR DE STUDART 2750;JOAQUIM TAVORA;60120002;FORTALEZA;CE;
34985598000137;CONDOMINIO ED NIMES;R EDUARDO SALGADO 25;ALDEOTA;60150140;FORTALEZA;CE;
34985606000145;EDIFICIO ILHABELA;R LAURO MAIA 661;FATIMA;60055295;FORTALEZA;CE;
34985614000191;CONDOMINIO RESIDENCIAL NAPOLEAO VIANA;R UM 55 RES NAPOLEAO VIANA;DIAS MACEDO;60860470;FORTALEZA;CE;
34985671000170;CONDOMINIO RESIDENCIAL ANA NERY;R GRIJALVA COSTA 480;JD AMERICA;60410437;FORTALEZA;CE;
34986471000132;CONDOMINIO DO ED MARIA DE MARILAC;R G 660;MANOEL DIAS BRANCO;60191070;FORTALEZA;CE;
34986489000134;CONDOMINIO DO ED VERONA;AV HERACLITO GRACA 141;CENTRO;60140061;FORTALEZA;CE;
34986588000116;EDIFICIO ACONCAGUA;R FONSECA LOBO 1400;ALDEOTA;60175020;FORTALEZA;CE;
35003714000138;CONDOMINIO ED TROPICAL;AV DOS EXPEDICIONARIOS 4774;PARREAO;60410302;FORTALEZA;CE;
35003813000110;CONDOMINIO ED PRINCE;TV CASTRO ALVES 720;CENTRO;60160160;FORTALEZA;CE;
35003839000168;CONDOMINIO CRISTIANE;R ADRIANO MARTINS 81;JACARECANGA;60010590;FORTALEZA;CE;
35003862000152;CONDOMINIO ED TEREZA MARIA;R G 300;MANOEL DIAS BRANCO;60191070;FORTALEZA;CE;
35003870000107;CONDOMINIO ED BRAGANCA;R BARBOSA DE FREITAS 815 815;MEIRELES;60170020;FORTALEZA;CE;
35003946000196;CONDOMINIO RESIDENCIAL CHOPIN;R NUNES VALENTE 1988;ALDEOTA;60125035;FORTALEZA;CE;
35003961000134;VANESSA;R A 77;VL VELHA;60342130;FORTALEZA;CE;
35003987000182;CONDOMINIO ED ISTAMBUL;R CEL JUCA 291;MEIRELES;60170320;FORTALEZA;CE;
35003995000129;CONDOMINIO DO ED MONACO;R JOAQUIM NABUCO 871 TER;ALDEOTA;60125055;FORTALEZA;CE;
35004027000137;CONDOMINIO ED BARCELONA;R ANTONIO AUGUSTO 1450;ALDEOTA;60110371;FORTALEZA;CE;
35004076000170;CONDOMINIO DO ED AZIZ ARY;R DEP MOREIRA DA ROCHA 439;MEIRELES;60160060;FORTALEZA;CE;
35004167000105;CONDOMINIO BELO HORIZONTE;VL MINAS GERAIS 149;PAN AMERICANO;60441040;FORTALEZA;CE;
35004183000106;CONDOMINIO EDFICIO SEIXAS;R JULIO IBIAPINA 89;MEIRELES;60170220;FORTALEZA;CE;
35004191000144;CONDOMINIO DO ED ALFAVILLE;R BR DE ARACATI 1565;ALDEOTA;60115081;FORTALEZA;CE;
35004209000108;CONDOMINIO RESIDENCIAL LOS ANGELES;R PAULO MORAIS 303;VARJOTA;60160330;FORTALEZA;CE;
35004241000193;CONDOMINIO EDFICIO MINISTRO MARCOS FREIRE;R G 855;MANOEL DIAS BRANCO;60191070;FORTALEZA;CE;
35004258000140;CONDOMINIO ED GOYA;R SEN MACHADO 260;MUCURIPE;60165170;FORTALEZA;CE;
35004290000126;CODOMINIO ED ATALAIA;R EDUARDO GARCIA 1100;ALDEOTA;60150100;FORTALEZA;CE;
35004340000175;CONDOMINIO SHERIDAN;R PROF CARVALHO 2950;JOAQUIM TAVORA;60120205;FORTALEZA;CE;
35004357000122;CONDOMINIO ED ALERCE;R REPUBLICA DO LIBANO 999;MEIRELES;60160140;FORTALEZA;CE;
35004373000115;CONDOMINIO ED ORION RESIDENCE;R OSVALDO CRUZ 620;MEIRELES;60125150;FORTALEZA;CE;
35004423000164;CONDOMINIO ED MATHEUS MENDES;R DR ALFREDO WEYNE 100;FATIMA;60415065;FORTALEZA;CE;
